Interprete;Codigo;Nome;Trecho;Idioma
Paralamas do Sucesso;3281;UMA BRASILEIRA;Rodas em sol trovas em do;BRA
Paralamas do Sucesso;3688;VOCÊ;Você é algo assim é tudo pra mim;BRA
Pat Boone;4536;LOVE LETTERS IN THE SAND;On a day like today;EUA
Pato Fú;4309;DEPOIS;Não foi dessa vez mas pode ter certeza;BRA
Patrícia Marx;3079;ESPELHO D'ÁGUA;Hum seus olhos são espelhos d'água;BRA
Patrícia Marx;6416;FESTA DO AMOR;Uô uô uh uô... No livro de leitura que você me;BRA
Patrícia Marx;3226;QUANDO CHOVE;Quando olho nos teus olhos;BRA
Patrick Hernandez;4690;BORN TO BE ALIVE;Born born to be alive yes we were born;EUA
Patrick Swayze;4767;SHE'S LIKE THE WIND;She's like the wind through my tree;EUA
Patrulha do Samba;4335;RALA NO PEZINHO;Menina chega pra cá;BRA
Patti Page;4506;CHANGING PARTNERS;We were waltzing together to a;EUA
Patti Page;4586;I WENT TO YOUR WEDDING;I went to your wedding altho' I was;EUA
Paula Fernandes;15169;CUIDAR MAIS DE MIM;Eu vim falar do que eu perdi;BRA
Paula Fernandes;15173;EU SEM VOCÊ;Eu tô carente desse teu abraço;BRA
Paula Fernandes;15306;NÃO FUI EU;Ei escuta pare de agir feito criança escuta;BRA
Paula Fernandes;15190;SE O CORAÇÃO VIAJAR;Sabe só agora eu pude abrir os olhos;BRA
Paula Fernandes;15197;UM SER AMOR;Você veio inteiro como o dia;BRA
Paul Anka;4620;CRAZY LOVE;Crazy love it's just a crazy love I love you;EUA
Paul Anka;4509;DIANA;I'm so young and you're so old this my darling;EUA
Paul Anka;4646;PAPA;Every day my Papa would work to;EUA
Paul Anka;4758;PUPPY LOVE;And they called it puppy love;EUA
Paulinho da Viola ;4315;FOI UM RIO QUE PASSOU EM MINHA VIDA;Se um dia meu coração...;BRA
Paulinho da Viola ;6623;NERVOS DE AÇO;Você sabe o que é ter um amor meu;BRA
Paul McCartney;4705;EBONY AND IVORY;Ebony and ivory live together in perfect;EUA
Paul McCartney;4746;NO MORE LONELY NIGHTS;I can wait another day until I call you;EUA
Paulo Diniz;3765;PINGOS DE AMOR;A vida passa, telefono e você;BRA
Paulo Diniz;3735;UM CHOPE PRA DISTRAIR;Ela passou, deixando um sorriso no;BRA
Paulo Ricardo;3910;DOIS;Quando você disse nunca mais;BRA
Paulo Sérgio;4486;NO DIA EM QUE PARTI;No dia em que parti Você chorou;BRA
Paulo Sérgio;3734;ÚLTIMA CANÇÃO;Esta é a última canção que eu faço;BRA
Pedro e Thiago;6411;É MELHOR ASSIM;Eu só vim pra te falar good bye good by;BRA
Pedro e Thiago;6584;PRA ONDE VOCÊ FOR (WHEREVER YOU WILL GO);De noite eu penso quem estará no meu;BRA
Pedro Luís;15214;CAIO NO SUINGUE;Eu caio no suingue é pra me consolar;BRA
Pe. Fábio de Mello;4356;IÊ IÊ IÊ DE JESUS;Iê iê iê... Ou ou ou... Reza reza reza;BRA
Pe. Fábio de Mello;4328;O VIRA DE JESUS;E os homens por que vieram;BRA
Pe. Fábio de Mello;15191;SEJA BEM-VINDO;Pode chegar seja bem vindo ao coração;BRA
Peggy Lee;4529;JOHNNY GUITAR;Play the guitar play it again my Johnny;EUA
Pe. Marcelo-Chitãozinho e Xororó;6025;PARABÉNS PRA JESUS;Tudo que nós já vivemos;BRA
Pena Branca e Xavantinho;6480;VIOLA QUEBRADA;Quando da brisa no açoite a flor da noite;BRA
Peninha;4464;ARREPIA;Nós estamos dando certo;BRA
Peninha;4359;MATEMÁTICA;Você gosta de sonhar olhando as estrelas;BRA
Peninha;3936;SONHOS;Tudo era apenas uma brincadeira;BRA
Pepê e Nenem;6015;ESPERANDO PRA TE AMAR;Hum ah ah ah Ié... Esse seu jeito bom;BRA
Pepê e Nenem;4401;NADA ME FAZ ESQUECER;Na na na... Se você for embora vou fingir;BRA
Pepê e Nenem;4324;NA MAIOR;Lua de cristal sonho perigoso de viver;BRA
Pepeu Gomes;3256;SEXY YEMANJÁ;A noite vai ter lua cheia;BRA
Peppino Di Capri;3830;CHAMPAGNE;Champagne per brindare a un incontro;ITA
Peppino Di Capri;3681;ROBERTA;Lo sai non e vero che non ti voglio pi;ITA
Percy Sledge;4801;WHEN A MAN LOVES A WOMAN;When a man loves a woman;EUA
Pericles;16937;MELHOR EU IR;Melhor eu ir tudo bem vai ser melhor;BRA
Péricles;16873;ATE QUE DUROU;Tentei fazer valer a pena;BRA
Peri Ribeiro;3010;ALGUÉM COMO TU;Alguém como tu;BRA
Perla;4452;PEQUENINA;Pequenina do meu amor;BRA
Perlla-Belo;7939;DEPOIS DO AMOR;Eu quero mais um pouco mais depois do amor;BRA
Perry Como;4564;AND I LOVE YOU SO;And I love you so the people ask me how how;EUA
Peter Paul and Mary;4501;500 MILES;If you miss the train I'm on you will know that;EUA
Peter Paul and Mary;4648;PUFF;Puff the magic dragon lived by the sea;EUA
Phil Collins;4680;ANOTHER DAY IN PARADISE;She calls out to the man on the street;EUA
Phil Collins;4751;ONE MORE NIGHT;One more night... I've been trying;EUA
Pique Novo;6008;CHEGA DE SOFRER;Há tempo você não me liga;BRA
Pique Novo;6519;UMA ESTRELA;Conversei com uma estrela caminhando pelas;BRA
Pirilampo e Saracura;3694;BOIADEIRO ERRANTE;Eu venho vindo de uma querência distante;BRA
Pirilampo e Saracura;3460;CABECINHA NO OMBRO;Encosta tua cabecinha no meu ombro e;BRA
Pirlimpimpim;3129;LINDO BALÃO AZUL;Eu vivo sempre no mundo da lua;BRA
Pixote;4382;A LUA E EU;Tanto tempo se passou a lua e eu;BRA
Pixote;4438;FRENESI;Nada se compara ao nosso amor;BRA
Platters (The);4543;ONLY YOU;Only you can make this world;EUA
Platters (The);4769;SMOKE GETS IN YOUR EYES;They asked me how I knew My true love;EUA
Platters (The);4785;THE GREAT PRETENDER;Oh yes, I'm the great pretender;EUA
Plebe Rude;6048;ATÉ QUANDO ESPERAR;Não é nossa culpa nascemos já com uma;BRA
P.O. BOX;4444;NÃO TÔ ENTENDENDO;Conheci uma garota Supergata de;BRA
P.O. BOX;4368;PAPO DE JACARÉ;Tô viajando na onda dessa menina;BRA
Police (The);4576;EVERY BREATH YOU TAKE;Every breath you take every move you;EUA
Police (The);4763;ROXANNE;Roxanne you don't have to put on the red light;EUA
Pollo-Ivo Mozart;15198;VAGALUMES;Vou caçar mais de um milhão de vagalumes;BRA
Preto no Branco;3369;MARAVILHOSA;Estou sabendo que o seu caso de amor;BRA
Procol Harum;4666;A WHITER SHADE OF PALE;We skipped the light fandango and turned;EUA
Quarteto em CY-MPB4;4271;FALANDO DE AMOR;Se eu pudesse por um dia esse amor e;BRA
Queen;19370;BOHEMIAN RHAPSODY;"Is this the real life is this just fantasy
";EUA
Queen;4797;WE ARE THE CHAMPIONS;I've paid my dues time after time;EUA
Raça Negra;3461;CAROLINE;Você veio pra me fazer feliz;BRA
Raça Negra;3046;CHEIA DE MANIAS;Cheia de manias toda dengosa;BRA
Raça Negra;3463;CIGANA;Não deixe o tempo acabar com o nosso;BRA
Raça Negra;3049;CIÚME DE VOCÊ;Se você demora mais um pouco eu fico louco;BRA
Raça Negra;4310;DEUS ME LIVRE;Te amo mas não quero;BRA
Raça Negra;3083;ESTOU MAL;Eu pensei que fosse fácil te esquecer;BRA
Raça Negra;3072;É TARDE DEMAIS;Olha só você depois de me perder;BRA
Raça Negra;3120;JEITO FELINO;Só de pensar que sua boca;BRA
Raça Negra;3137;MARAVILHA;Foi bom te encontrar foi bom te;BRA
Raça Negra;3146;ME LEVA JUNTO COM VOCÊ;No mel do seu beijo tem o gosto do;BRA
Raça Negra;3196;OI (ESTOU TE AMANDO);É legal demais ter você pra mim;BRA
Raça Negra;3482;O QUE EU FAÇO SEM VOCÊ;O que eu faço sem você;BRA
Raça Negra;3212;PENSANDO EM VOCÊ;Sempre que estou sozinho fico pensando;BRA
Raça Negra;3634;PRECISO DESSE AMOR;À noite no meu quarto, solidão;BRA
Raça Negra;3537;PRECISO TER ALGUÉM;De novo a solidão bateu, eu vou chora;BRA
Raça Negra;3231;QUE PENA;Que pena tudo acabar que pena você me;BRA
Raça Negra;3491;SEU AMOR JÁ TERMINOU;Seu amor já terminou você já nem liga;BRA
Raça Negra;3258;SÓ COM VOCÊ;Eu não quero mais fazer amor à toa;BRA
Raça Negra;3494;SOZINHO;Todo aquele sonho que sonhei;BRA
Raça Negra;3495;TE QUERO COMIGO;Não dá pra ficar sem você;BRA
Raça Negra-Reginaldo Rossi;6491;DEIXA DE BANCA;Parabadá... pará paradá... Deixa de banca;BRA
Rádio Táxi;3425;EVA;Meu amor olha só hoje o sol não apareceu;BRA
Raimundos;4342;A MAIS PEDIDA;Nesse show não entra menor;BRA
Raimundos;3879;I SAW YOU SAYING;Reconheci a Madonna ali parada no jardim;BRA
Raimundos;4283;MULHER DE FASES;Que mulher ruim jogou minhas coisas fora;BRA
Raul Gil;15254;LONAS AZUIS;No caminho da sorte a alma perdi;BRA
Raul Sampaio;15188;QUEM EU QUERO NÃO ME QUER;Quem eu quero não me quer quem me quer;BRA
Raul Seixas;3652;CAPIM GUINÉ;Plantei um sítio no sertão de Piritiba;BRA
Raul Seixas;3089;EU NASCI HÁ DEZ MIL ANOS ATRÁS;Um dia numa rua da cidade eu vi um;BRA
Raul Seixas;3327;GITA;Eu que já andei pelos quatro cantos do mundo;BRA
Raul Seixas;3133;MALUCO BELEZA;Enquanto você se esforça pra ser;BRA
Raul Seixas;3147;MEDO DA CHUVA;É pena que você pense que eu sou seu;BRA
Raul Seixas;3760;METAMORFOSE AMBULANTE;Eu prefiro ser essa metamorfose ambulante;BRA
Raul Seixas;3897;"ROCK DAS ""ARANHA""";Subi no muro do quintal e vi uma transa que;BRA
Raul Seixas;6512;SOCIEDADE ALTERNATIVA;Viva viva viva a Sociedade Alternativa;BRA
Raul Seixas;6033;TENTE OUTRA VEZ;Veja não diga que a Canção está perdida;BRA
Raul Seixas;3687;TREM DAS 7;Ói, ói o trem vem surgindo de trás das;BRA
Ray Charles;4519;I CAN'T STOP LOVING YOU;Those happy hours that we once knew;EUA
Ray Charles;4554;UNCHAIN MY HEART;Unchain my heart;EUA
Razão Brasileira;3088;EU MENTI;Eu menti quando disse que não te queria;BRA
Razão Brasileira;3715;NATURALMENTE;Entre nós dois talvez possa acontecer;BRA
Reginaldo Rossi;4262;A RAPOSA E AS UVAS;Lembro com muita saudade daquele baile;BRA
Reginaldo Rossi;4480;LEVIANA;Eu te amei me entreguei;BRA
Renato e Seus Blue Caps;3922;MENINA LINDA;Ah! Deixa essa boneca faça-me o favor;BRA
Renato Russo;6539;MAIS UMA VEZ;Mas é claro que o sol vai voltar amanhã;BRA
Renato Russo;3639;STRANI AMORI;Mi dispiace deve andare via;ITA
Restart;15246;CARA DE SANTA;Ela me ligou disse tô nem aí ;BRA
Ricardo Chaves;3185;O BICHO;Quando o vento bater nos seus cabelos;BRA
Richard Marx;4747;NOW AND FOREVER;Whenever I'm weary;EUA
Richie Valens;4704;DONNA;Oh Donna Oh Donna... I had a girl;EUA
Rick e Renner;4266;CARA DE PAU;Eu não tenho vergonha na cara;BRA
Rick e Renner;6571;EU SEM VOCÊ;Meus dias sem te ver são difíceis de viver;BRA
Rick e Renner;4395;FIM DE SEMANA;Do jeito que você me olha você me;BRA
Rick e Renner;4362;MULEKA;Gruda gruda na cintura da muleka;BRA
Rick e Renner;6027;PRA FICAR DEZ;É pra remexer Pra requebrar;BRA
Rick e Renner;6510;SÓ PENSANDO EM VOCÊ;Recordações não param de atormentar;BRA
Rick e Renner;4460;VEM ME NAMORAR;Você revolucionou a minha vida;BRA
Ricky Martin;3574;MARIA;"Un dos tres um pasito pa\'delante Maria
";ESP
Righteous Brothers (The);4553;UNCHAINED MELODY;Oh my love my darling;EUA
Rionegro e Solimões;4261;A GENTE SE ENTREGA;Uma dose de saudade misturada com;BRA
Rionegro e Solimões;4389;BATE O PÉ;Alô galera bate a mão e bate o pé;BRA
Rionegro e Solimões;6459;ESTRELA GUIA;Eu não sei o que vou fazer da minha;BRA
Rionegro e Solimões;4312;FALTA VOCÊ;O dia vai se acabando a tarde vai se;BRA
Rionegro e Solimões;4439;FRIO DA MADRUGADA;Sei que você quer voltar Quem sou eu pra;BRA
Rionegro e Solimões;6620;NA SOLA DA BOTA;É na sola da bota é na palma da mão;BRA
Rionegro e Solimões;15310;O COWBOY VAI TE PEGAR;O cowboy vai te pegar o cowboy vai te;BRA
Rionegro e Solimões;6024;ORVALHO DA SAUDADE;Saudade faz cair orvalho;BRA
Rionegro e Solimões;4375;SÓ LEMBRANÇAS;Pra quem vive de saudade;BRA
Rionegro e Solimões;6593;TEMPORAL DE LÁGRIMAS;Quando a saudade chega sofre o coração;BRA
Rionegro e Solimões;6437;TÔ POR AÍ;Tô por aí por toda cidade curtindo saudade;BRA
Rita Lee;6523;AGORA SÓ FALTA VOCÊ;Um belo dia resolvi mudar e fazer tudo o que eu;BRA
Rita Lee;3509;BAILA COMIGO;Baila comigo;BRA
Rita Lee;3025;BANHO DE ESPUMA;Que tal nós dois numa banheira;BRA
Rita Lee;3041;CASO SÉRIO;Eu fico pensando em nós dois;BRA
Rita Lee;3610;COISAS DA VIDA;Quando a lua apareceu;BRA
Rita Lee;3061;DESCULPE O AUÊ;Desculpe o auê;BRA
Rita Lee;3065;DOCE VAMPIRO;Venha me beijar meu doce vampiro;BRA
Rita Lee;3103;FLAGRA;Xá xap xap xa á... No escurinho do cinema;BRA
Rita Lee;4357;JARDINS DA BABILÔNIA;Suspenderam os jardins da Babilônia;BRA
Rita Lee;3124;LANÇA PERFUME;Lança menina lança todo esse perfume;BRA
Rita Lee;3135;MANIA DE VOCÊ;Meu bem você me dá água na boca;BRA
Rita Lee;3674;NEM LUXO NEM LIXO;Como vai você? Assim como eu;BRA
Rita Lee;6022;O AMOR EM PEDAÇOS;Vivemos sob o mesmo teto;BRA
Rita Lee;3201;OVELHA NEGRA;Levava uma vida sossegada;BRA
Rita Pavone;3701;DATEMI UN MARTELO (REMIX);Tiú rú tiú rá... Datemi un martelo che cosa ne;ITA
Ritchie;3434;MENINA VENENO;Meia noite no meu quarto;BRA
Ritchie;3440;PELO INTERFONE;Chamo por você ninguém atende;BRA
Roberta Flack;4530;KILLING ME SOFTLY WITH HIS SONG;Strumming my pain with his fingers;EUA
Roberta Miranda;3360;DÓI;Dói sentir que o nosso amor;BRA
Roberta Miranda;3521;EU TE AMO, TE AMO, TE AMO;Tanto tempo longe de você;BRA
Roberta Miranda;3331;MEU DENGO;Vem cá meu dengo ai ai ai ai ai;BRA
Roberta Miranda;4365;NO CORAÇÃO A PAIXÃO NA CABEÇA O CIÚME;Depois de tanta solidão mil vezes o m;BRA
Roberta Miranda;3344;SÃO TANTAS COISAS;São tantas coisas só nós sabemos;BRA
Roberta Miranda;3396;VÁ COM DEUS;A cada dia que se passa;BRA
Roberto Carlos;4421;A GUERRA DOS MENINOS;Hoje eu tive um sonho que foi o mais;BRA
Roberto Carlos;3012;AMADA AMANTE;Esse amor demais antigo;BRA
Roberto Carlos;3825;AMANTE À MODA ANTIGA;Eu sou aquele amante à moda antiga;BRA
Roberto Carlos;3403;AMIGO;Você meu amigo de fé meu irmão camarada;BRA
Roberto Carlos;6045;AMOR SEM LIMITE;Quando a gente ama alguém de verdade;BRA
Roberto Carlos;15242;A MULHER QUE EU AMO;A mulher que eu amo tem a pele morena;BRA
Roberto Carlos;3905;AS CANÇÕES QUE VOCÊ FEZ PRA MIM;Hoje eu ouço as canções que você fez;BRA
Roberto Carlos;3309;CAFÉ DA MANHÃ;Amanhã de manhã vou pedir um café;BRA
Roberto Carlos;3050;COISA BONITA;Amo você assim e não sei pra que;BRA
Roberto Carlos;3314;COMO É GRANDE O MEU AMOR POR VOCÊ;Eu tenho tanto pra lhe falar mas com;BRA
Roberto Carlos;3700;COMO VAI VOCÊ?;Como vai você?;BRA
Roberto Carlos;3315;CORAÇÃO;Com o coração na voz e o grito mais;BRA
Roberto Carlos;4469;CUSTE O QUE CUSTAR;Já nem sei dizer Se sou feliz ou não;BRA
Roberto Carlos;3063;DETALHES;Não adianta nem tentar;BRA
Roberto Carlos;4432;DE TANTO AMOR;Ah! Eu vim aqui amor só pra me despedir;BRA
Roberto Carlos;3074;EMOÇÕES;Quando eu estou aqui;BRA
Roberto Carlos;3080;ESQUEÇA (FORGET HIM);Esqueça se ele não te ama;BRA
Roberto Carlos;3087;EU E ELA;Um grande amor começa agora;BRA
Roberto Carlos;3751;EU PRECISO DE VOCÊ;Eu preciso de você;BRA
Roberto Carlos;4270;EU TE DAREI O CÉU;Eu te darei o céu meu bem;BRA
Roberto Carlos;3913;FALANDO SÉRIO;Falando sério é bem melhor você parar;BRA
Roberto Carlos;4352;FORÇA ESTRANHA;Eu vi um menino correndo eu vi o tem;BRA
Roberto Carlos;15233;JOGO DE DAMAS;Eu sei da sua vida e do seu passado;BRA
Roberto Carlos;4320;LADY LAURA;Tenho às vezes vontade de ser;BRA
Roberto Carlos;3881;LOBO MAU;Eu sou do tipo que não gosta de casamento;BRA
Roberto Carlos;3580;MULHER DE 40;Sorriso bonito olhar de quem sabe;BRA
Roberto Carlos;3164;MULHER PEQUENA;Quando uma mulher pequena;BRA
Roberto Carlos;4402;NAMORADINHA DE UM AMIGO MEU;Estou amando loucamente;BRA
Roberto Carlos;6425;NEGRO GATO;Eu sou o negro gato de arrepiar e essa minha;BRA
Roberto Carlos;15309;O AMOR É MAIS;Pra saber o que é o amor é preciso amar;BRA
Roberto Carlos;6023;O CALHAMBEQUE;Essa é uma das muitas histórias...;BRA
Roberto Carlos;15237;O HOMEM;Um certo dia um homem esteve aqui;BRA
Roberto Carlos;15238;O HOMEM BOM;Vai como um vento solto numa campina;BRA
Roberto Carlos;3336;O PROGRESSO;Eu queria poder afagar;BRA
Roberto Carlos;3338;OS SEUS BOTÕES;Os botões da blusa;BRA
Roberto Carlos;3200;OUTRA VEZ;Você foi o maior dos meus casos;BRA
Roberto Carlos;15185;PELO AVESSO;E você reservada tão quieta não fala;BRA
Roberto Carlos;15267;PROMESSA;Amanhã estarei tão distante de ti;BRA
Roberto Carlos;3930;QUANDO;Quando você se separou de mim;BRA
Roberto Carlos;3235;QUERO QUE VÁ TUDO PRO INFERNO;De que vale o céu azul e o sol;BRA
Roberto Carlos;3597;TEM COISAS QUE A GENTE NÃO TIRA DO CORAÇÃO;Que bom te encontrar;BRA
Roberto Leal;3743;CASA PORTUGUESA;Numa casa portuguesa fica bem;BRA
Robinson Monteiro;6307;PRA SEMPRE EU VOU TE AMAR;Sei que nada vai mudar as nuvens se;BRA
Rockwell;4588;KNIFE;You touched my life with;EUA
Rodrigo Faro;4484;NÃO DIGA NADA;Olha pra mim Não diga nada;BRA
Roger Williams;4503;AUTUMN LEAVES;The falling leaves drift by the window the;EUA
Rolling Stones;4567;AS TEARS GO BY;It is the evening of the day I sit and watch;EUA
Ronnie Von;3003;A PRAÇA;Hoje eu acordei com saudades de você;BRA
Rosa de Saron;15729;CARTAS AO REMETENTE;Há quem amou demais há quem chorou;BRA
Rosana;3480;NEM UM TOQUE;Tanta coisa pra dizer e a gente nem se;BRA
Rosana;4366;O AMOR E O PODER;A música na sombra o ritmo no ar;BRA
Rosemary;6018;JÓIA;Como jóia rara que Precisa ser lapidada;BRA
Rouge;6527;BEIJO MOLHADO (STRAWBERRY KISSES);Quero tanto espero tanto seu beijo molhado;BRA
Rouge;6564;BRILHA LA LUNA;Quero uma noite pra bailar o zouk;BRA
Rouge;6499;NÃO DÁ PRA RESISTIR;Eu não quero confessar eu sei não quero;BRA
Rouge;6507;RAGATANGA (ASEREJÉ);Olha lá quem vem virando a esquina;BRA
Rouge;6639;UM ANJO VEIO ME FALAR;Tão difícil entender o coração;BRA
Rouge-KLB;6467;NUNCA DEIXE DE SONHAR;Há uma luz em algum lugar que vai fazer seu;BRA
Roupa Nova;3502;A FORÇA DO AMOR;Abriu minha visão no jeito do amor;BRA
Roupa Nova;3553;AMAR É...;Amar... é quando não dá mais pra disfar;BRA
Roupa Nova;3405;ANJO;Se você vê estrelas demais;BRA
Roupa Nova;3005;A VIAGEM;Há tanto tempo que eu deixei você;BRA
Roupa Nova;4265;CANÇÃO DE VERÃO;É como um sol de verão queimando no;BRA
Roupa Nova;3313;COMEÇO, MEIO E FIM;A vida tem sons que pra gente ouvir;BRA
Roupa Nova;3514;CRISTINA;Sua boca na minha;BRA
Roupa Nova;4471;DEIXA O AMOR ACONTECER;Qualquer coisa No meu coração;BRA
Roupa Nova;3515;DE VOLTA PRO FUTURO;Sou o mesmo que te amou;BRA
Roupa Nova;3068;DONA;Dona desses traiçoeiros;BRA
Roupa Nova;3527;LINDA DEMAIS;Linda só você me fascina;BRA
Roupa Nova;6067;MEU UNIVERSO É VOCÊ;Mais que a luz das estrelas ah ah;BRA
Roupa Nova;3630;NOSSA HISTÓRIA;Hoje eu venho outra vez meu lugar é;BRA
Roupa Nova;3253;SEGUINDO NO TREM AZUL;Confessar sem medo de mentir;BRA
Roupa Nova;6634;SHOW DE ROCK'N ROLL;Ela só se liga em astrologia;BRA
Roupa Nova;3550;VOLTA PRA MIM;Amanheci sozinho na cama, um vazio;BRA
Roupa Nova;3300;WHISKY A GO-GO;Foi numa festa gelo e cuba libre;BRA
Roxette;4727;IT MUST HAVE BEEN LOVE;It must have been love But it's over now;EUA
Roxette;4771;SPENDING MY TIME;What's the time;EUA
Royce do Cavaco;3004;A SAUDADE DÓI;Não ligue pro que aconteceu;BRA
Royce do Cavaco;3107;FRENTE À FRENTE;A gente se enganou pensando que era;BRA
Royce do Cavaco;3579;MEU CORAÇÃO É TEU;Infelizmente nós somos assim;BRA
Royce do Cavaco;3638;SÓ VOCÊ;Quando a luz se apaga;BRA
Roy Orbison;4645;ONLY THE LONELY;Only the lonely;EUA
Roy Orbison;4757;PRETTY WOMAN;Pretty woman walking down the street;EUA
RPM;4440;LOURAS GELADAS;Disfarça e faz que nem me viu;BRA
RPM;3197;OLHAR 43;Seu corpo é o fruto proibido;BRA
RPM;6471;ONDE ESTÁ O MEU AMOR;Onde está o meu amor quem será com quem;BRA
RPM;4334;RÁDIO PIRATA;Abordar navios mercantes;BRA
RPM;6589;RAINHA;Vem como uma chuva de verão;BRA
RPM;6440;VIDA REAL;Se você pudesse me dizer se você soubesse;BRA
Sá e Guarabyra;3078;ESPANHOLA;Por tantas vezes eu andei mentindo;BRA
Sá e Guarabyra;3260;SOBRADINHO;O homem chega e já desfaz a natureza;BRA
Sampa Crew;3358;CORAÇÃO TE ACALMA;Quantas vezes eu te disse coração;BRA
Sampa Crew;3475;MESMO ASSIM;Foram tantas coisas boas;BRA
Sampa Crew;3398;VERDADEIRA PAIXÃO;Eu vou além de mim sem nada temer;BRA
Sandra de Sá;4463;AGORA EU SEI;Você me diz Que eu sou seu ar;BRA
Sandra de Sá;3308;BYE BYE TRISTEZA;Ninguém aqui é puro anjo ou demônio;BRA
Sandra de Sá;6031;SOLIDÃO;Solidão dá um Tempo e vá saindo;BRA
Sandra de Sá;3594;SOZINHA;Às vezes no silêncio da noite;BRA
Sandro e Gustavo;4381;A GARAGEM DA VIZINHA;Lá na rua onde eu moro conheci uma;BRA
Sandy e Júnior;6002;A LENDA;Bem lá no céu Uma lua existe;BRA
Sandy e Júnior;4387;APRENDER A AMAR;Ô uô ô ô... Tenho um segredo pra contar;BRA
Sandy e Júnior;4347;AS QUATRO ESTAÇÕES;A noite cai o frio desce;BRA
Sandy e Júnior;6059;EU ACHO QUE PIREI;Quando eu te vi na minha frente;BRA
Sandy e Júnior;4317;IMORTAL (IMMORTALITY);É bem assim que estou é tudo que restou;BRA
Sandy e Júnior;3370;MARIA CHIQUINHA;Que cô cê foi fazê no mato Maria Chiquinha;BRA
Sandy e Júnior;6577;NADA É POR ACASO;Já faz algum tempo que eu fui te declarar;BRA
Sandy e Júnior;6428;O AMOR NOS GUIARÁ;Vamos ter momentos a chorar  nós vamos ter;BRA
Sandy e Júnior;4488;OLHA O QUE O AMOR ME FAZ;Meu coração bate Ligeiramente apertado;BRA
Sandy e Júnior;3222;PRA DANÇAR COM VOCÊ;No baile da escola eu espero você;BRA
Sandy e Júnior;6554;SUPER HEROI (NÃO É FÁCIL);Não quero imitar Deus ou coisa assim...;BRA
Sandy - Tiago Iorc;16011;ME ESPERA;"Eu ainda estou aqui perdido em mil versões
";BRA
Santa Esmeralda;4675;YOU'RE MY EVERYTHING;You're my everything;EUA
Santana;6010;CORAZON ESPINADO;Esa mujer me esta matando Me a;BRA
Santana;4624;EVIL WAYS;You've got to change your evil ways baby;EUA
Saulo Fernandes;15283;A CASA AMARELA;Papai pintou a casa de amarelo a frente;BRA
Scott McKenzie;4765;SAN FRANCISCO;If you're going to San Francisco;EUA
Secos e Molhados;4364;MULHERES DE ATENAS;Mirem-se no exemplo daquelas mulheres;BRA
Secos e Molhados;3193;O VIRA;O gato preto cruzou a estrada;BRA
Secos e Molhados;4293;ROSA DE HIROSHIMA;Pensem nas crianças mudas telepáticas;BRA
Selma Reis;3727;SOMBRA EM NOSSO OLHAR;Sei, só não sei porque penso em você;BRA
Sem Compromisso;3914;FELICIDADE ESCONDIDA;Deixo um beijo de adeus;BRA
Sem Compromisso;3138;MARIANA, PARTE MINHA;Se eu beijar a sua boca;BRA
Sempre Livre;3424;EU SOU FREE;Só estudei em escola experimental;BRA
Sempre Livre;6493;FUI EU;Os pés descalços queimando o asfalto;BRA
Sensação;3317;CORAL DE ANJOS;Um coral de anjos cantou;BRA
Sensação;4330;PALMA DA MÃO;Vamo pro pagode Mané o tantan é a;BRA
Sensação;3929;PRECISO DESSE MEL;Quando a sua beleza pisou;BRA
Sensação;3898;SENTIMENTO NU;É... tudo era azul sentimento nu;BRA
Sérgio e Tchelo;6436;TE BUSQUEI NAS AVENIDAS;Já é tarde tá chovendo é madrugada;BRA
Sérgio Murilo;3651;BROTO LEGAL;Oh, oh, que broto legal garota fenomenal;BRA
Sérgio Reis;6602;ADEUS MARIANA;Nasci lá na cidade me casei na serra;BRA
Sérgio Reis;3556;CAVALO PRETO;"Tenho um cavalo preto por nome de ""Ventania";BRA
Sérgio Reis;3557;CHICO MINEIRO;Fizemos a última viagem;BRA
Sérgio Reis;3055;CORAÇÃO DE PAPEL;Se você pensa que meu coração...;BRA
Sérgio Reis;4477;FILHO ADOTIVO;Com sacrifício eu criei meus sete filhos;BRA
Sérgio Reis;3915;FUI PRA CASA DA VIZINHA;Tomei uma cervejada no bar da dona;BRA
Sérgio Reis;3632;O MENINO DA PORTEIRA;Toda vez que eu viajava;BRA
Sérgio Reis;3589;PANELA VELHA;Tô de namoro com uma moça solteirona;BRA
Sérgio Reis;4331;PINGA NI MIM;Nesta casa tem goteira pinga ni mim;BRA
Sérgio Reis;3593;SAUDADE DA MINHA TERRA;De que me adianta viver na cidade;BRA
Severino Araújo;3014;ANOS DOURADOS;Parece que dizes te amo Maria;BRA
Shakira;3750;DÓNDE ESTÁS CORAZÓN?;Dónde estás corazón?;ESP
Shakira;3662;ESTOY AQUI;Ya sé que no vedrás todo lo que fué;ESP
Sheldon Harnick-Jerry Bock;4655;SUNRISE SUNSET;Is this the little girl I carried?;EUA
Sidney Magal;15206;A MOÇA;A moça já não sorri nem mostra o seu coração;BRA
Sidney Magal;4295;SANDRA ROSA MADALENA;Quero vê-la sorrir Quero vê-la cantar...;BRA
Sílvio Brito;3746;CIDADÃO;Tá vendo aquele edifício moço?;BRA
Simon and Garfunkel;4571;BRIDGE OVER TROUBLED WATER;When you're weary feeling small when tears;EUA
Simone;3840;ESPERE POR MIM, MORENA;Espere por mim, morena espere que eu;BRA
Simone;3366;IOLANDA;Esta canção não é mais que mais uma;BRA
Simone;3234;QUEM É VOCÊ;Quem será que me chega na toca da noite;BRA
Simone e Simaria;16249;REGIME FECHADO;Alô eu tô ligando só pra te dizer;BRA
Simone e Simaria - Anitta;16166;LOKA;"Cadê você que ninguém viu
";BRA
Simony;3744;CERTAS COISAS;Não existiria som;BRA
Simony;3538;QUANDO TE VI;Nem o sol, nem o mar;BRA
Simony-Alexandre;3382;PELO MENOS UMA VEZ;Descansei a dor no azul do mar;BRA
Skank;6006;BALADA DO AMOR INABALÁVEL;Leva essa canção de Amor dançante pra;BRA
Skank;6406;CANÇÃO NOTURNA;Misterioso luar de fronteira derramando;BRA
Skank;6609;DOIS RIOS;O céu está no chão o céu não cai do alto;BRA
Skank;3658;É PROIBIDO FUMAR;É proibido fumar diz o aviso que eu;BRA
Skank;3077;ESMOLA;Uma esmola pelo amor de Deus;BRA
Skank;3618;EU DISSE A ELA;Quando eu disse a ela que o amor;BRA
Skank;3659;É UMA PARTIDA DE FUTEBOL;Ô Bola na trave não altera o placar;BRA
Skank;3472;GAROTA NACIONAL;Aqui nesse mundinho fechado;BRA
Skank;3119;JACKIE TEQUILA;Funk lá no morro da mangueira;BRA
Skank;3846;MACACO PREGO;Eu sou macaco prego;BRA
Skank;3631;O HOMEM QUE SABIA DEMAIS;Sabia? Sim sabia mais e mais e mais;BRA
Skank;3379;PACATO CIDADÃO;Ôh pacato cidadão eu te chamei a atenção;BRA
Skank;3595;TÃO SEU;Sinto sua falta, não posso esperar;BRA
Skank;3393;TE VER;Te ver e não te querer;BRA
Skank;4459;TRÊS LADOS;Escutei alguém abrir os portões é;BRA
Skeeter Davis;4551;THE END OF THE WORLD;Why does the sun go on shining;EUA
Smokie;4639;LIVING NEXT DOOR TO ALICE;Sally called when she got the word;EUA
Só Pra Contrariar;3604;AMOR VERDADEIRO;Olhe dentro de mim, você pode se ver;BRA
Só Pra Contrariar;3907;BOCA A BOCA;Foi assim que aconteceu nossa;BRA
Só Pra Contrariar;4431;DE CORPO SEM ALMA;Às vezes a solidão;BRA
Só Pra Contrariar;3749;DEPOIS DO PRAZER;Tô fazendo amor, com outra pessoa;BRA
Só Pra Contrariar;3066;DÓI DEMAIS;Tá doendo sim tá doendo em mim;BRA
