Interprete;Codigo;Nome;Trecho;Idioma
14 Bis;3755;LINDA JUVENTUDE;Zabelê, zumbi, besouro vespa fabricando;BRA
14 Bis;6074;PLANETA SONHO;Aqui ninguém mais ficará de...;BRA
365;6549;SÃO PAULO;Tem dias que eu digo não invento no meu;BRA
5 a Seco - Maria Gadú;15225;EM PAZ;Caiu do céu se revelou anjo da noite e das manhãs;BRA
Abba;4574;DANCING QUEEN;Yeh! you can dance you can jive;EUA
Abba;4787;THE WINNER TAKES IT ALL;I don't wanna talk;EUA
A Cor do Som;6402;ABRI A PORTA;Abri a porta apareci a mais bonita sorriu pra;BRA
A Cor do Som;15200;VIVA;Viva a alegria e viva o prazer;BRA
Adalberto e Adriano;3726;SEPARAÇÃO;Qual terá sido o motivo da nossa separação;BRA
Adriana Calcanhoto;6573;JUSTO AGORA;Eu ouvi dizer que você assim;BRA
Adryana e a Rapaziada;4458;SÓ FALTAVA VOCÊ;"Só faltava você pra completar
";BRA
Adryana e a Rapaziada;6035;TUDO PASSA;Tudo na vida passa Tudo na ...;BRA
Adryana Ribeiro;3789;E AGORA?;E agora como é que eu vou ficar;BRA
Adryana Ribeiro-Luiz Carlos;3390;SEMPRE SOU EU;É... mais uma vez estou chorando;BRA
Aerosmith;4678;AMAZING;I get the right ones out the wrong ones in had;EUA
Agepê;6454;DEIXA EU TE AMAR;Quero ir na fonte do teu ser e banhar;BRA
Agepê;3883;MOÇA CRIANÇA;O seu andar tem jeito de moça...;BRA
Agepê;3848;MORO ONDE NÃO MORA NINGUÉM;Moro, onde não mora ninguém;BRA
Aggeu Marques;15178;MÁQUINA DO TEMPO;Finjo não saber que o tempo passa logo;BRA
Agnaldo Rayol;3739;AMIGOS PARA SEMPRE;Eu não tenho nada pra dizer;BRA
Agnaldo Rayol;3737;A PRAIA;Em plena praia no céu azul ...;BRA
Agnaldo Timóteo;4399;MEU GRITO;Se eu demoro mais aqui eu vou morrer;BRA
Agnaldo Timóteo;6503;OS VERDES CAMPOS DA MINHA TERRA;Se algum dia à minha terra eu voltar;BRA
Agnaldo Timóteo;4370;QUEM É;Quem é que não sofre por alguém;BRA
Agridoce (Pitty);15202;130 ANOS;Caro é transformar-se num arremendo de si próprio;BRA
Akundum;3563;EMACONHADA;Kaya erva danada... É reggae sim se é reggae;BRA
Albert Hammond;4626;FOR THE PEACE OF ALL MANKIND;You turn me on so bad that there was on;EUA
Alceu Valença;3903;ANUNCIAÇÃO;Na bruma leve das paixões;BRA
Alceu Valença;6452;COMO DOIS ANIMAIS;Uma moça bonita de olhar agateado;BRA
Alceu Valença;15223;DONA DE 7 COLINAS;Ela é dona de sete colinas debruçadas ;BRA
Alceu Valença;3880;LA BELLE DE JOUR;Ah! eh! ah! Eh... La belle de jour... Eu lembro;BRA
Alceu Valença;3277;TROPICANA (MORENA TROPICANA);Da manga rosa quero o gosto e o sumo;BRA
Alcione;6521;A LOBA;Sou doce dengosa polida fiel como um cão;BRA
Alcione;3060;DELÍRIO DO AMOR (CHAMEGO);Você acaba dando um jeito;BRA
Alcione;3169;NÃO DEIXE O SAMBA MORRER;Não deixe o samba morrer;BRA
Alcione;6626;O MUNDO É DE NÓS DOIS;Esse nosso amor é a perfeição;BRA
Alcione;3263;SUFOCO;Não sei se vou aturar esses abusos não sei se;BRA
Alcione;3270;TÔ COM SAUDADE;Tô com saudade amor;BRA
Alexandre Pires;6443;A MUSA DAS MINHAS CANÇÕES;No palco de um pequeno bar eu nunca imaginei;BRA
Alexandre Pires;1073;DESSA VEZ EU ME RENDO;Dizem que amor não mata mas judia da;BRA
Alexandre Pires;15834;QUEM É VOCÊ;Eu descobri quem você é posso estar equivocado mas;BRA
Alexandre Pires;6988;TIRA ELA DE MIM;Tira a lembrança que ela deixou;BRA
Alexandre Pires;6640;VEM ME AMAR (AMAME);Vem aqui doce amor me ajuda a mudar esse;BRA
All-4-One;4669;I SWEAR;I swear by the moon and;EUA
Al Martino;4592;LOVE IS BLUE;Blue blue my world is blue;EUA
Almir Rogério;3877;FUSCÃO PRETO;Me disseram que ela foi vista com outro;BRA
Almir Sater;4379;UM VIOLEIRO TOCA;Quando uma estrela cai no escurão da;BRA
Al Stewart;4806;YEAR OF THE CAT;On a morning from a Bogart movie;EUA
Altemar Dutra;4465;BALADA TRISTE;Balada triste Que me faz lembrar alguém;BRA
Altemar Dutra;6608;CONTIGO APRENDI;Contigo aprendi que existem coisas novas;BRA
Altemar Dutra;3872;ESTÃO VOLTANDO AS FLORES;Vê... Estão voltando as...;BRA
Altemar Dutra;6496;MARIA HELENA;Maria Helena és tu a minha ...;BRA
Altemar Dutra;6422;MEU VELHO (MI VIEJO);É um bom tipo meu velho e anda só e;BRA
Altemar Dutra;3926;O TROVADOR;Sonhei que eu era um dia um trovador;BRA
Altemar Dutra;3540;SENTIMENTAL DEMAIS;Sentimental eu sou ...;BRA
Amado Batista;6625;O FRUTO DO NOSSO AMOR (AMOR PERFEITO);Amor perfeito existia entre nós dois;BRA
Amado Batista;4327;O POBRETÃO;Que pena que eu não posso ser;BRA
Amado Batista;3856;PRINCESA;Ao te ver pela primeira vez;BRA
Amado Batista;15268;QUEM É VOCÊ;Quem é você que me escreve ;BRA
Amelinha;3876;FOI DEUS QUEM FEZ VOCÊ;Foi Deus que fez o céu o rancho das estrelas;BRA
Amelinha;3796;FREVO MULHER;Quantos aqui ouvem, os olhos eram de;BRA
Ana Cañas;15272;SERÁ QUE VOCÊ ME AMA?;Tudo do avesso tudo certo tudo no começo;BRA
Ana Carolina;15288;COMBUSTÍVEL;Fiz de você meu combustível meu ;BRA
Ana Carolina;6413;ELA É BAMBA;Ela é bamba ela é bamba... ;BRA
Ana Carolina;4316;GARGANTA;Minha garganta estranha quando não te;BRA
Anderson Freire;16073;RARIDADE;"Não consigo ir além do teu olhar
";BRA
Andy Williams;4581;HAWAIIAN WEDDING SONG;This is the moment I've waited for;EUA
Andy Williams;4538;LOVE STORY;Where do I begin? to tell the;EUA
Andy Williams;4539;MOON RIVER;Moon River wider than a mile;EUA
Andy Williams;4595;MORE;More than the greatest love;EUA
Ângela Rô Rô;6635;SÓ NOS RESTA VIVER;Dói em mim saber que a solidão existe;BRA
Angélica;3429;MAGIA;Sol de verão queimando no meu corpo;BRA
Angélica;4361;MEU HERÓI;Ele é meu herói príncipe encantado;BRA
Ângelo Máximo;6561;A PRIMEIRA NAMORADA;A chuva já molhou a rua a noite está chegando;BRA
Ângelo Máximo;6456;DOMINGO FELIZ (BEAUTIFUL SUNDAY);Meu domingo alegre vai ser pois pretendo sair;BRA
Animals (The);4623;DON'T LET ME BE MISUNDERSTOOD;Baby, do you understand me now;EUA
Animals (The);4552;THE HOUSE OF THE RISING SUN;There is a house in New Orleans;EUA
Anitta;15302;MENINA MÁ;Me olha e deseja que eu veja mas já digo;BRA
Anitta;15307;NÃO PARA;Hoje cê pode chegar que eu tô querendo;BRA
Anitta;15192;SHOW DAS PODEROSAS;Prepara que agora é hora do show das ;BRA
Anitta;15320;ZEN;Ohh ... Olha cê me faz tão bem só de;BRA
Annie Lennox;4745;NO MORE I LOVE YOUS;I used to be lunatic from the gracious;EUA
Antônio Carlos e Jocafi;3549;VOCÊ ABUSOU;Você abusou tirou partido de mim abusou;BRA
Antônio Fagundes;4427;CANTO ALEGRETENSE;Não me perguntes onde fica o Alegrete;BRA
Antônio Marcos;4376;SONHOS DE UM PALHAÇO;"Vejam só que história boba...
";BRA
Aphrodite's Child;4759;RAIN AND TEARS;Rain and tears are the same;EUA
Araketu;3017;ARA KETU BOM DEMAIS;Não dá pra esconder;BRA
Araketu;6060;FACE OCULTA;Ô ô ié ié ié ié hum... Sonhei com você será;BRA
Araketu;4323;MINHA RAZÃO DE VIVER;Como eu digo ao meu coração;BRA
Araketu;3586;NOSSA GUERRA SANTA;Esse nosso amor é uma loucura;BRA
Araketu;3893;PIPOCA;O Araketu o Araketu quando toca;BRA
Araketu;3389;SEMPRE SERÁ;Gosto de ficar te olhando;BRA
Araketu;3775;TENTAÇÃO;No meu corpo ficou a lembrança;BRA
Araketu;6560;VOLTA;Amor minha maior felicidade é ver você;BRA
Arches;4654;SUGAR SUGAR;Sugar ah honey honey;EUA
Arlindo Farias;6447;BICHO DO MATO;Sou bicho feito do mato não tenho medo;BRA
Arnaldo Antunes;15203;A CASA É SUA;Não me falta cadeira não me falta sofá;BRA
Arriba Saia;6614;LIBERA O TÓIM;Sequestraram o Toim sequestraram o Toim;BRA
Art Popular;4344;AGAMAMOU;A galera lá do morro do Salgueiro e;BRA
Art Popular;3306;BOM BOCADO;Ai ai ai... Oh oh oh... Como um bom bocado;BRA
Art Popular;4435;DIZEM QUE A FELICIDADE;Dizem que a felicidade é um momento;BRA
Art Popular;3797;FRICOTE;Você é meu amor te quero de novo;BRA
Art Popular;3845;IRAÊ;Vejo você me olhar ah, que olhar;BRA
Art Popular;6065;MANEIRAS;Se eu quiser fumar eu fumo;BRA
Art Popular;3582;NANI;Quantas vezes Nani tantas vezes Nani;BRA
Art Popular;3535;PIMPOLHO;Pimpolho é um cara bem legal;BRA
Art Popular;4490;POR DEUS;De manhã o sol me diz...;BRA
Art Popular;4410;QUANDO VOCÊ ME BEIJA;Um beijo durante aquele amor;BRA
Art Popular;3544;TEMPORAL;Faz tempo que a gente não...;BRA
Art Popular;3598;TRAPAÇA;Quando você passa tento te dizer;BRA
Art Popular;3349;UTOPIA;Pra se dizer que a emoção;BRA
Art Popular;3285;VALEU DEMAIS;Ai valeu demais valeu valeu demais;BRA
Asa de Águia;3909;DANÇA DA MANIVELA;Dança da manivela;BRA
Asa de Águia;4321;MARÉ MANSA;Amor não dá pra te aturar desse jeito;BRA
Asa de Águia;3714;NÃO TEM LUA;Não tem lua que faça você me amar;BRA
As Meninas;4475;EU TENHO A MANHA;Saiu de casa e foi...;BRA
As Meninas;4456;SAMBA DA NEGA MALUCA;"""Afe"" Maria Ô nega danada";BRA
As Meninas;4419;XIBOM BOMBOM;Bom xibom xibom bombom bom xibom xibom;BRA
Ataulfo Alves;3007;AI! QUE SAUDADE DA AMÉLIA;Nunca vi fazer tanta exigência;BRA
Ataulfo Alves;3022;ATIRE A PRIMEIRA PEDRA;Covarde sei que me podem chamar;BRA
Ataulfo Alves;6631;SEI QUE É COVARDIA... MAS;Sei que é covardia mas um homem chorar por;BRA
Augusto César;3249;SAUDADE;Estou lendo a carta que você...;BRA
Babado Novo;6565;CAI FORA;Eu não quero te prender diga onde você;BRA
Baby do Brasil (Baby Consuelo);4372;SEM PECADO E SEM JUÍZO;Dia após dia começo a encontrar;BRA
Bala Bombom e Chocolate;6050;CAIXA POSTAL;Umdharan dharará... Diz pra mim como pôde;BRA
Bala Bombom e Chocolate;4351;FISSURAS DE UM CASAL;"Hoje eu acordei e ouvi a nossa canção
";BRA
Balão Mágico (A turma do);3454;AMIGOS DO PEITO;Meu nome é Mike gosto muito de brincar;BRA
Banda Bach;3354;ATÉ DE MANHÃ;Amor aquilo foi demais pra mim;BRA
Banda Brasil;3412;COMO DÓI;Se eu estou sofrendo é por...;BRA
Banda Brasil;3093;EU TE AMO, TE AMO, TE AMO;Tanto tempo longe de você;BRA
Banda Brasil;3220;PODEROSA;Pode ser que eu consiga esquecer mas eu;BRA
Banda Calypso;6531;CUMBIA DO AMOR;O amor que sinto por você é o maior...;BRA
Banda Calypso;6490;DANÇANDO CALYPSO;Chega pra cá meu bem que eu vou te ensinar;BRA
Banda Cheiro de Amor;3657;É DEMAIS MEU REI;Vou dar a volta pelo globo terrestre;BRA
Banda Cheiro de Amor;3084;ESTRELA PRIMEIRA;"É luz do meu ser a fonte mais pura do viver
";BRA
Banda Cheiro de Amor;3176;NOSSA GENTE (AVISA LÁ);Avisa lá que eu vou chegar mais tarde;BRA
Banda Cheiro de Amor;3927;OLHA EU AÍ;Olha... ê olha eu olha eu sim;BRA
Banda Cheiro de Amor;3891;PEGA NO BALANÇO;É bom demais fazer amor;BRA
Banda Cheiro de Amor;3732;TODO MUNDO DANÇA;Todo mundo dança move corpo, move;BRA
Banda Cheiro de Amor;3599;VAI SACUDIR, VAI ABALAR;Vai sacudir vai abalar explode coração;BRA
Banda Eva;3823;ALÔ PAIXÃO;Eu não vou perder você;BRA
Banda Eva;3607;BELEZA RARA;Eu não posso deixar que o tempo;BRA
Banda Eva;3465;COLEÇÃO;Sei que você gosta de brincar de amor;BRA
Banda Eva;3920;LEVA EU;Oh! Leva eu, eva, eva;BRA
Banda Eva;3371;ME ABRAÇA;Quando você passa eu sinto o seu cheiro;BRA
Banda Eva;3900;VEM MEU AMOR;Quando te vejo paro logo em teu olhar;BRA
Banda Eva - Timbalada;15236;NANÁ NANÁ;Ê naná naná ê ê...Quero sentir do teu corpo um abraço ;BRA
Banda Magníficos;4303;AMOR ESCONDIDO;Esquece tudo que te ensinaram;BRA
Banda Magníficos;6019;ME FAZ UM DENGO;Êta peneirado gostoso é...;BRA
Banda Magníficos;3712;ME USA;Momentos de amor quero com você;BRA
Banda Magníficos;6030;SÓ DEPENDE DE NÓS;"Só depende de nós ""Pega"" fogo os lençóis";BRA
Banda Mel;3023;BAIANIDADE NAGÔ;Êh ôh êh ôh laiá... Já pintou verão calor no;BRA
Banda Mel;3028;BATEU SAUDADE;Jura jura que me dá o seu amor;BRA
Banda Mel;3359;CRENÇA E FÉ;Vou dar a volta no mundo;BRA
Banda Mel;3383;PREFIXO DE VERÃO;Aê aê...ei ei... Quando você chegar quando;BRA
Barão Vermelho;3511;BETE BALANÇO;Pode seguir a tua estrela;BRA
Barão Vermelho;3890;O POETA ESTÁ VIVO;Baby, compra o jornal e vem ver o sol;BRA
Barão Vermelho;4369;POR VOCÊ;Por você eu dançaria tango no teto;BRA
Barão Vermelho;3223;PRO DIA NASCER FELIZ;Todo o dia a insônia me convence que;BRA
Barbra Streisand;4658;THE WAY WE WERE;Memories light the corners of my mind;EUA
Barbra Streisand;4613;WOMAN IN LOVE;Life is a moment in space;EUA
Barclay James Harvest;4647;POOR MAN'S MOODY BLUES;All the nights that I've missed you;EUA
Barry Manilow;4691;CAN'T SMILE WITHOUT YOU;You know I can't smile without you I can't;EUA
Barry Manilow;4719;I WRITE THE SONGS;I've been alive forever and I wrote;EUA
Barry Manilow;4736;MANDY;I remember all my life;EUA
Bay City Rollers;4650;SATURDAY NIGHT;"Saturday night Saturday night...
";EUA
Beach Boys (The);4652;SLOOP JOHN B.;We'll come on the sloop, John B.;EUA
Beatles (The);4563;AND I LOVE HER;I give her all my love that's all I do and if you;EUA
Beatles (The);4507;COME TOGETHER;Here come old flat top He come grooving up;EUA
Beatles (The);4628;GIRL;Is there anybody gone to listen to my story;EUA
Beatles (The);4518;HELP;Help I need somebody not just anybody help;EUA
Beatles (The);4714;HEY JUDE;Hey Jude, don't make it bad;EUA
Beatles (The);4525;I WANNA HOLD YOUR HAND;Oh yeah I'll tell you something;EUA
Beatles (The);4534;LET IT BE;When I find myself in times of trouble;EUA
Beatles (The);4739;MICHELLE;Michelle, ma belle these are words that;EUA
Beatles (The);4644;OBLADI OBLADA;Desmond has a barrow in the marketplace;EUA
Beatles (The);4770;SOMETHING;Something in the way she moves;EUA
Beatles (The);4674;THE LONG AND WINDING ROAD;The long and winding road;EUA
Beatles (The);4793;TWIST AND SHOUT;Well shake it up baby Twist and Shout;EUA
Beatles (The);4559;YESTERDAY;Yesterday all my troubles seemed  so far away;EUA
Bee Gees;4511;DON'T FORGET TO REMEMBER;Oh my heart won't believe that you have left;EUA
Bee Gees;4708;FIRST OF MAY;When I was small and Christmas trees;EUA
Bee Gees;4716;HOW DEEP IS YOUR LOVE;I know your eyes in the morning sun;EUA
Bee Gees;4585;I STARTED A JOKE;I started a joke which started;EUA
Bee Gees;4737;MASSACHUSETTS;Feel I'm going back to Massachusetts;EUA
Bee Gees;4743;NIGHTS ON BROADWAY;"Here we are in a room full
";EUA
Bee Gees;4772;STAYIN' ALIVE;Well you can tell by the way I use my w;EUA
Bee Gees;4791;TOO MUCH HEAVEN;Nobody gets too much heaven no more;EUA
Bee Gees;4665;WORDS;Smile an everlasting smile;EUA
Belchior;3015;APENAS UM RAPAZ LATINO AMERICANO;Eu sou apenas um rapaz;BRA
Belchior;3921;MEDO DE AVIÃO;Foi por medo de avião;BRA
Belchior;3854;PARALELAS;"Dentro do carro sobre o trevo
";BRA
Belchior;6556;TODO SUJO DE BATOM;Eu estou muito cansado do peso da minha;BRA
Belo;6012;DESAFIO;Já virou desafio Me apossar do teu;BRA
Belo;6057;ETERNAMENTE;Por que por que que todo amor;BRA
Belo;4499;TUA BOCA;Mel tua boca tem um mel E melhor sabor;BRA
Benito Di Paula;3698;CHARLIE BROWN;Eh meu amigo Charlie;BRA
Benito Di Paula;6477;TUDO ESTÁ NO SEU LUGAR;Tudo está no seu lugar graças...;BRA
Benito Di Paula;3777;VAI FICAR NA SAUDADE;Você cortou o barato do meu amor;BRA
Berlin;4781;TAKE MY BREATH AWAY;Watching every motion;EUA
Bertie Higgins;4573;CASABLANCA;I fell in love with you watching Casablanca;EUA
Beth Carvalho;6441;1800 COLINAS;Subi mais de mil e oitocentas colinas;BRA
Beth Carvalho;3302;ANDANÇA;Vim tanta areia, andei;BRA
Beth Carvalho;6055;COISINHA DO PAI;Ô coisinha tão bonitinha do pai;BRA
Beth Carvalho;3296;VOU FESTEJAR;Chora não vou ligar não vou ligar;BRA
Beto Barbosa;3650;BALANÇA O BUMBUM MUCHACHA;"Quando eu te vejo bate meu...
";BRA
Beto Barbosa;3457;BEIJINHO NA BOCA;Beijinho na boca gostoso doce mel;BRA
Beto Barbosa;3419;DONA;É amor e prazer uma louca paixão;BRA
Beto Barbosa;3407;EMBALO TRILEGAL;Eu vou mostrar pra você como se dança;BRA
Beto Barbosa;3153;MEU AMOR NÃO VÁ EMBORA;Meu amor não vá embora não;BRA
Beto Barbosa;3485;PRETA;Preta fala pra mim;BRA
Beto Guedes;6420;MARIA SOLIDÁRIA;Eu choro de cara suja meu papagaio o vento;BRA
Beto Guedes;6544;PAISAGEM DA JANELA;Da janela lateral do quarto de dormir;BRA
Beto Guedes;3493;SOL DE PRIMAVERA;Quando entrar setembro;BRA
Bette Midler;4657;THE ROSE;Some say love it is a river;EUA
Biafra (Byafra);6435;SONHO DE ÍCARO;Voar voar subir subir ir por onde for;BRA
Billy Joel;4583;HONESTY;If you search for tenderness;EUA
Billy Joel;4601;PIANO MAN;It's nine o'clock on a Saturday;EUA
Biquini Cavadão;6475;TÉDIO;Alô sabe esses dias em que horas;BRA
Biquini Cavadão;3268;TIMIDEZ;Toda vez que te olho crio um romance;BRA
Biquini Cavadão;3287;VENTO E VENTANIA;Vento e ventania me leve;BRA
Biro do Cavaco;3570;JÉSSICA;Sem a gente esperar nasce uma;BRA
B.J.Thomas;4546;RAINDROPS KEEP FALLING ON MY HEAD;Raindrops keep falling on my head;EUA
B.J.Thomas;4761;ROCK AND ROLL LULLABY;She was just sixteen and all alone;EUA
Blitz;6041;A DOIS PASSOS DO PARAÍSO;Longe de casa há mais de uma semana;BRA
Blitz;3132;MAIS UMA DE AMOR;Perdi meu amor no paraíso;BRA
Blitz;3444;QUEM TEM PÕE;Eu moro longe não tenho carro;BRA
Blitz;3293;VOCÊ NÃO SOUBE ME AMAR;"Sabe essas noites que cê sai caminhando
";BRA
Blitz;3299;WEEKEND;Alô alô ativo ouvinte;BRA
Bobby Solo;3690;ZÍNGARA;Prendi questa mano zíngara;ITA
Bob Marley;4718;I SHOT THE SHERIFF;I shot the sheriff but I didn't shoot;EUA
Boi Bumbá Caprichoso;6049;BRASIS AMERÍNDIOS;América América Ybyrapytanga Araboutan;BRA
Boi Bumbá Garantido;6058;ETERNO CAMPEÃO;Garantido meu brinquedo de...;BRA
Bonde do Tigrão;6053;CEROL NA MÃO;Quer dançar quer dançar o Tigrão vai te;BRA
Boney M.;4760;RIVERS OF BABYLON;By the rivers of Babylon there we;EUA
Bozo;15201;1, 2, 3...VAMOS LÁ;Alô criançada o Bozo chegou trazendo alegria;BRA
Bozo;15271;SEMPRE RIR;Sempre rir sempre rir pra viver é melhor sempre rir;BRA
Braga Boys;6036;UMA BOMBA;Sensual O movimento sensual;BRA
Bread;4681;AUBREY;And Aubrey was her name and not so very;EUA
Bread;4682;BABY I'M A WANT YOU;Baby I'm a want you Baby I'm a need you;EUA
Bread;4521;IF;If a picture paints a thousand words;EUA
Bread;4735;MAKE IT WITH YOU;Hey, have you ever tried;EUA
Bread;4783;THE DIARY;I found her diary underneath a tree;EUA
Bread;4786;THE GUITAR MAN;Who draws the crowd and plays so loud;EUA
Bruno e Marrone;4302;AGARRADA EM MIM;Enquanto a cidade dorme eu aqui me;BRA
Bruno e Marrone;6484;AGORA VAI;Vai pode ir embora antes que a chuva caia;BRA
Bruno e Marrone;6448;BIJUTERIA;Quando a noite cai é que eu sinto a falta;BRA
Bruno e Marrone;6529;CREDO EM CRUZ AVE MARIA;Desce uma geladinha que hoje eu vou;BRA
Bruno e Marrone;15935;DORMI NA PRAÇA (VERSÃO ESTÚDIO);"Eu caminhei sozinho pela rua
";BRA
Bruno e Marrone;15232;JÁ NÃO SEI MAIS NADA;Eu não sei dizer se este amor;BRA
Bruno e Marrone;6615;LIGAÇÃO URBANA;Alô amor tô te ligando de um orelhão;BRA
Bruno e Marrone;6541;MENINA;Menina cada instante em minha vida;BRA
Bruno e Marrone;6431;PROGRAMA DE FIM DE SEMANA;Não me deixe fora da sua agenda;BRA
Bruno e Marrone;3938;TE AMO E NÃO TE QUERO;Pegue tudo aquilo que é seu;BRA
Bruno e Marrone;4300;VIDA VAZIA;Depois que você foi embora;BRA
Bruno e Marrone;15199;VIDRO FUMÊ;Foi num telefonema anônimo;BRA
Bryan Adams;4706;EVERYTHING I DO (I DO IT FOR YOU);Look into my eyes you will see;EUA
Bryan Adams;4713;HEAVEN;Oh thinkin' about all our younger years;EUA
Bryan Adams;4755;PLEASE FORGIVE ME;It still feels like our first night together;EUA
Caetano Veloso;3741;BELEZA PURA;Não me amarra dinheiro não;BRA
Caetano Veloso;3867;CHUVA, SUOR E CERVEJA;Não se perca de mim;BRA
Caetano Veloso;3837;DEBAIXO DOS CARACÓIS DOS SEUS CABELOS;Um dia a areia branca seus pés irão;BRA
Caetano Veloso;3070;É HOJE;A minha alegria atravessou o mar;BRA
Caetano Veloso;4276;LONDON LONDON;I'm wandering round and round;EUA
Caetano Veloso;3668;LUA DE SÃO JORGE;Lua de São Jorge, lua deslumbrante;BRA
Caetano Veloso;4286;O LEÃOZINHO;Gosto muito de te ver leãozinho;BRA
Caetano Veloso;4409;QUALQUER COISA;Esse papo já tá qualquer coisa;BRA
Caetano Veloso;3723;QUEIXA;Um amor assim delicado;BRA
Caetano Veloso;3246;SAMPA;Alguma coisa acontece no meu coração;BRA
Caetano Veloso;6439;TRILHOS URBANOS;O melhor o tempo esconde longe muito longe;BRA
Caetano Veloso;3292;VOCÊ É LINDA;"Fonte de mel nos olhos de gueixa
";BRA
Caetano Veloso - Gal Costa;3937;SORTE;Tudo de bom que voce me fizer;BRA
Caetano Veloso - Gilberto Gil;6533;DESDE QUE O SAMBA E SAMBA;A tristeza e senhora desde que o samba;BRA
Caetano Veloso - Jorge Mautner;6594;TODO ERRADO;Eu no peco desculpa e nem peco perdo;BRA
Capital Inicial;6445;A SUA MANEIRA;Ela dormiu no calor dos meus braços;BRA
Capital Inicial;6607;COMO DEVIA ESTAR;Folhas verdes caem no jardim coisas que;BRA
Capital Inicial;4318;INDEPENDÊNCIA;Toda essa curiosidade;BRA
Capital Inicial;6538;MAIS;É sempre frio é tão estranho podia ser perfeito;BRA
Capital Inicial;3165;MÚSICA URBANA;Contra todos contra ninguém;BRA
Capital Inicial;6069;NATASHA;Tem dezessete anos e fugiu de casa;BRA
Capital Inicial;6505;QUATRO VEZES VOCÊ;Rafael tá trancado há dois dias no banheiro;BRA
Capital Inicial;15194;SOL ENTRE NUVENS;Várias portas num quarto pequeno;BRA
Capital Inicial-Kiko Zambianchi;6028;PRIMEIROS ERROS;Meu caminho é cada manhã;BRA
Carlinhos Brown;3601;A NAMORADA;Ei bicho o broto do seu lado;BRA
Carlos Gonzaga;6632;SERENO;Sereno da madrugada caindo no meu;BRA
Carlos Oliva e Los Sobrinos;3368;MACARENA;Dale a tu cuerpo alegria Macarena;ESP
Carly Simon;4695;COMING AROUND AGAIN;Baby sneezes momy pleases daddy breezes;EUA
Carnaval;3782;ALLAH LA ÔH;Allah la ô, ô ô ô... Mas que calor;BRA
Carnaval;3783;AURORA;Se você fosse sincera ô, ô, ô, ô...;BRA
Carnaval;3785;CACHAÇA;Você pensa que cachaça é água;BRA
Carnaval;3787;CORAÇÃO DE JACARÉ;Trocaram o coração da minha sogra;BRA
Carnaval;3800;JARDINEIRA;Ó jardineira por que estás tão triste?;BRA
Carnaval;3802;MAMÃE EU QUERO;Mamãe eu quero, mamãe eu quero;BRA
Carnaval;3805;ME DÁ UM DINHEIRO AÍ;"Ei, você aí me dá um dinheiro aí
";BRA
Carnaval;3810;QUEM SABE, SABE;Quem sabe, sabe conhece bem;BRA
Carnaval;3812;SACA ROLHA;As águas vão rolar;BRA
Carnaval;3813;SASSARICANDO;Sa-sassaricando!;BRA
Carnaval;3817;TAÍ;Taí... Eu fiz tudo pra você gostar de mim;BRA
Carole King;4730;IT'S TOO LATE;Stayed in bed all mornin' just to pass;EUA
Carol Song;4528;JINGLE BELLS;"Dashing thru' the snow
";EUA
Carol Song;4604;SILENT NIGHT;Silent Night Holy Night;EUA
Carol Song;4651;SILVER BELLS;City side walks busy side walks;EUA
Carol Song;4664;WHITE CHRISTMAS;"I'm dreaming of a White Christmas
";EUA
Carpenters;4728;IT'S GONNA TAKE SOME TIME;It's gonna take some time this time;EUA
Carpenters;4752;ONLY YESTERDAY;After long enough of being alone;EUA
Carpenters;4756;PLEASE MR. POSTMAN;Oh yes wait a minute Mister Postman;EUA
Carpenters;4606;SUPERSTAR;Long ago and oh so far away;EUA
Carpenters;4612;TOP OF THE WORLD;Such a feelin's comin' over me;EUA
Carpenters;4615;YESTERDAY ONCE MORE;When I was young I'd listen to the;EUA
Carrapicho;3565;FESTA DE UM POVO;Ôh ôh ôh... lê lê lê... Boi garantido chegou;BRA
Cartola;3018;AS ROSAS NÃO FALAM;Bate outra vez com esperanças;BRA
Cascades (The);4649;RHYTHM OF THE RAIN;Listen to the rhythm of the falling rain;EUA
Cascatinha e Inhana;3365;ÍNDIA;Índia seus cabelos nos ombros caindo;BRA
Cássia Eller;3661;E.C.T.;Tava com cara que carimba postais;BRA
Cássia Eller;3623;MALANDRAGEM;Quem sabe eu ainda sou uma garotinha;BRA
Cássia Eller;6429;O MEU MUNDO FICARIA COMPLETO (COM VOCÊ);Não é porque eu sujei a roupa bem agora que;BRA
Cássia Eller;6343;O SEGUNDO SOL;Quando o segundo sol chegar para realinhar as;BRA
Cassiane;5613;HINO DA VITÓRIA;Quem é o Homem que teve o poder;BRA
Catedral;6514;TCHAU;Me cansei dos teus desenganos não entendo;BRA
Cauby Peixoto;4468;CONCEIÇÃO;Conceição eu me lembro Muito bem;BRA
Cauby Peixoto;6618;MOLAMBO;Eu sei que vocês vão dizer;BRA
Cavalo de Pau;3763;PADECER NO PARAÍSO;Eu vivi todo esse tempo só pra você;BRA
Cazuza;4390;BRASIL;Não me convidaram pra esta festa pobre;BRA
Cazuza;3312;CODINOME BEIJA FLOR;Pra que mentir fingir que perdoou tentar;BRA
Cazuza;3095;EXAGERADO;Amor da minha vida;BRA
Cazuza;3099;FAZ PARTE DO MEU SHOW;Te pego na escola e encho a tua bola;BRA
Cazuza;3364;IDEOLOGIA;Meu partido é um coração partido;BRA
Cazuza;3847;MAIOR ABANDONADO;Eu tô perdido, sem pai nem mãe;BRA
Cazuza;3377;O NOSSO AMOR A GENTE INVENTA;O teu amor é uma mentira;BRA
Cazuza;4454;QUASE UM SEGUNDO;Eu queria ver No escuro do mundo;BRA
Cazuza;3731;TODO AMOR QUE HOUVER NESTA VIDA;Eu quero a sorte de um amor tranquilo;BRA
C.C.R.;4616;BAD MOON RISING;I see a bad moon arising I see trouble on the;EUA
C.C.R.;4508;COTTON FIELDS;When I was a little baby my mother would;EUA
C.C.R.;4580;HAVE YOU EVER SEEN THE RAIN;Someone told me long ago;EUA
C.C.R.;4591;LODI;Just about a year ago;EUA
C.C.R.;4602;PROUD MARY;Left a good job in the city;EUA
C.C.R.;4656;SUSIE Q;Oh Susie Q oh Susie Q;EUA
C.C.R.;4792;TRAVELIN' BAND;Seven-thirty-seven comin' out of the;EUA
C.C.R.;4795;UP AROUND THE BEND;There's a place up ahead and I'm goin';EUA
Cecéu Muniz;15257;MEXA A LOMBA LOMBA;Mexa a lomba lomba hum... Pro nosso samba;BRA
Cecéu Muniz;15260;MOLEM MOLEM;É o Cecéuzinho que chegou corpão de mola;BRA
Cecéu Muniz;6550;SEM PERCEBER;Me peguei juntando as partes da nossa;BRA
Celine Dion;4685;BECAUSE YOU LOVED ME;For all those times you stood by me for all the;EUA
Celine Dion;3924;MY HEART WILL GO ON;Every night In my dreams I see you, I f;EUA
Celine Dion-Bee Gees;4723;IMMORTALITY;So this is who I am and this is all I;EUA
Celly Campello;3026;BANHO DE LUA;Tomo um banho de lua fico branca com;BRA
Celly Campello;3085;ESTÚPIDO CUPIDO;Oh oh cupido vê se deixa em paz;BRA
César Menotti e Fabiano;15305;NÃO ERA EU;Não era eu não era eu confundiram o meu;BRA
César Menotti e Fabiano - Jorge e Mateus;15222;DOIS CORAÇÕES;Louco pra te ver não via hora de chegar e te abraçar;BRA
Céu;15230;FALTA DE AR;Isso me dá falta de ar;BRA
