Interprete;Codigo;Nome;Trecho;Idioma
Fagner;3127;LEMBRANÇAS DE UM BEIJO;Quando a saudade invade o ...;BRA
Fagner;6464;MUITO AMOR;Amor febril amor viril amor adolescente;BRA
Fagner;3179;NOTURNO;O aço dos meus olhos;BRA
Fagner;3180;NUNCA;Nunca nem que o mundo caia ;BRA
Fagner;6508;REVELAÇÃO;Um dia vestido de saudade viva;BRA
Fagner;3361;VOCÊ ENDOIDECEU MEU CORAÇÃO;Você endoideceu meu coração;BRA
Falamansa;6604;CEM ANOS;É... Não foi por falta de ...;BRA
Falamansa;6066;MEDO DE ESCURO;Tem dias que a gente acorda com medo do;BRA
Falamansa;6502;OH CHUVA;Você que tem medo de chuva ...;BRA
Falamansa;6040;XOTE DOS MILAGRES;Escrevi seu nome na areia;BRA
Fama Coral;6457;ESPERANÇA;Quem aqui chegou quem aqui ...;BRA
Família Lima;6034;TEU BEIJO;Por tanto tempo esperei;BRA
Fat Family;4311;EU NÃO VOU;Thu ru ru ru... Se você demorar eu não vou te;BRA
Fat Family;4398;MADRUGADA;Êh ei eh... Sharira... Eu gosto é da madrugada;BRA
Fat Family;4450;OH HAPPY DAY;Oh happy day oh happy day;EUA
Felipe Araújo;16286;AMOR DA SUA CAMA;E se eu despir a minha alma;BRA
Fernanda Abreu;3385;BABILÔNIA ROCK;Ha ha ei ei... Rio Babilônia ou... Você vai cair;BRA
Fernanda Abreu;15234;JORGE DA CAPADÓCIA;Jorge sentou praça na cavalaria;BRA
Fernanda Abreu;3397;VENENO DA LATA;Mil novecentos e noventa e ...;BRA
Fernanda Porto;6597;TUDO DE BOM;Só poderia ser sempre com você;BRA
Fernando e Sorocaba;15303;MÔ;Ôôôôôô ... Mô você foi embora e agora o;BRA
Fincabaute ;3832;COISA DE MALUCO;É coisa de maluco alguém falou;BRA
Flor de Cheiro;3529;MENINO LINDO;Menino lindo eu preciso do ...;BRA
Four Aces;4671;LOVE IS A MANY SPLENDORED THING;Love is a many splendored thing;EUA
Franco;15263;O ROCK DO RATO;O rato roeu a roupa do rei de Roma;BRA
Franco;15269;ROCK ENREDO;Andam dizendo por aí que o ...;BRA
Frank Aguiar;4363;MULHER MADURA;Mulher nova é muito boa mas a madura;BRA
Frank Aguiar;4449;O HINO DAS LOIRAS;Forró forró forró Frank Aguiar;BRA
Frank Sinatra;4722;I'VE GOT YOU UNDER MY SKIN;I've got you under my skin;EUA
Frank Sinatra;4670;LET ME TRY AGAIN;I know I said that I was leaving;EUA
Frank Sinatra;4540;MY WAY;And now the end is near;EUA
Frank Sinatra;4673;NEW YORK, NEW YORK;Start spreading the news I'm leaving today;EUA
Frank Sinatra;4742;NIGHT AND DAY;Night and day you are the one;EUA
Frank Sinatra;4774;STRANGERS IN THE NIGHT;Strangers in the night exchanging;EUA
Fred Bongusto;3675;O SOLE MIO;Che bella cosa 'na iurna ta'e sole;ITA
Frejat;15179;MARIA;Seu oi é como uma passagem para;BRA
Frejat;6474;SEGREDOS;Eu procuro um amor que ainda não encontrei;BRA
Fresno;1214;DESDE QUANDO VOCÊ SE FOI;Mais uma história com um ...;BRA
Fundo de Quintal;3861;A AMIZADE;Lá lá iá... Meu amigo, amigo hoje;BRA
Fundo de Quintal;4446;NOSSO GRITO;Você já não quer mais amar;BRA
Fundo de Quintal;3857;RESPONDE;Responde se me quer de verdade;BRA
Gabriel Valim;15186;PIRADINHA;Piri pipire pipire pire piradinha;BRA
Gaby Amarantos;15212;BEBA DOIDA;Ela tá beba doida...;BRA
Gal Costa;3016;AQUARELA DO BRASIL;Brasil meu Brasil brasileiro...;BRA
Gal Costa;3024;BALANCÊ;Oh balancê balancê quero...;BRA
Gal Costa;3357;CHUVA DE PRATA;Se tem luar no céu...;BRA
Gal Costa;3101;FESTA DO INTERIOR;Fagulhas pontas de agulhas...;BRA
Gal Costa;3578;MEU BEM, MEU MAL;Você é meu caminho, meu...;BRA
Gal Costa;3334;NADA MAIS;Sinto quando alguém te...;BRA
Gal Costa;6582;O AMOR EM PAZ;Eu amei e amei ai de mim...;BRA
Gal Costa;3280;UM DIA DE DOMINGO;Eu preciso te falar te...;BRA
Gal Costa;4500;VAPOR BARATO;Oh sim Eu estou tão cansado...;BRA
Gal Costa-Gilberto Gil;3587;ODARA;Deixa eu dançar pro meu...;BRA
Gang 90 e Absurdettes;4447;NOSSO LOUCO AMOR;Nosso louco amor está em seu...;BRA
Gang do Samba;4292;RAIMUNDA;Essa menina tá de brincadeira...;BRA
G-Clefs;4634;I UNDERSTAND;I understand just how you...;EUA
Genival Lacerda;6633;SEVERINA XIQUE-XIQUE;Quem não conhece Severina...;BRA
George Freedman;6606;COISINHA ESTÚPIDA;Existe um amor dentro de mim...;BRA
George Michael;4692;CARELESS WHISPERS;I feel so unsure as I take your...;EUA
Geraldo Azevedo;15221;DIA BRANCO;Se você vier pro que der e vier...;BRA
Gera Samba;3552;A DANÇA DA CORDINHA;Passa negão, passa loirinha;BRA
Gera Samba;3501;A DANÇA DO BUMBUM;Conheci uma menina que veio do sul;BRA
Gera Samba;3150;MELÔ DO TCHAN;Pau que nasce torto nunca se endireita;BRA
Gera Samba;3381;PAQUEREI;É o novo som de Salvador é o...;BRA
Gian e Giovani;3404;AMOR DEMAIS;Deixa preparado nosso...;BRA
Gian e Giovani;6047;APERTE O PLAY;De repente você vem e diz...;BRA
Gian e Giovani;4422;A VERDADE VEIO À TONA;Quando o coração Não sabe...;BRA
Gian e Giovani;3415;DEPOIS DO ADEUS;O que é que eu vou fazer de...;BRA
Gian e Giovani;3418;DÓI;Dói dói demais em mim eu te...;BRA
Gian e Giovani;4349;DOIS CORAÇÕES;Rolo na cama dormir não...;BRA
Gian e Giovani;3873;EU BUSCO UMA ESTRELA;No que está pensando?...;BRA
Gian e Giovani;15251;FONTE DE DESEJOS;Seu corpo é uma fonte de...;BRA
Gian e Giovani;4479;GOL DO CORAÇÃO;Bola da direita Pra esquerda...;BRA
Gian e Giovani;3433;MEDO;Bandida solidão vou te...;BRA
Gian e Giovani;3673;NÃO VIVO SEM VOCÊ;Todo dia é a mesma coisa já...;BRA
Gian e Giovani;4405;NEM DORMINDO CONSIGO TE ESQUECER;Não é fácil ficar sem você...;BRA
Gian e Giovani;3435;NOSSA SENHORA DE APARECIDA;Eu tenho fé... Que dessa vez...;BRA
Gian e Giovani;3438;OLHA AMOR;Olha amor Tô morrendo de...;BRA
Gian e Giovani;3448;TE AMO MENINA;Teus olhos menina têm raios...;BRA
Gian e Giovani;3450;UM DOIS TRÊS;De uma cachaça boa não abro...;BRA
Gigliola Cinquetti;4541;NON HO L'ETA PER AMARTI;Non ho l'eta non ho l'eta...;ITA
Gilberto Gil;3863;AQUELE ABRAÇO;Este samba vai pra Dorival...;BRA
Gilberto Gil;4473;ESPERANDO NA JANELA;Ainda me lembro Do seu...;BRA
Gilberto Gil;3792;ESTRELA;Há de surgir uma estrela no...;BRA
Gilberto Gil;3756;MARACATU ATÔMICO;Atrás do arranha-céu tem o...;BRA
Gilberto Gil;3850;NÃO CHORES MAIS;No woman no cry no woman...;BRA
Gilberto Gil;4288;PALCO;Uá pá pá pá... Subo nesse...;BRA
Gilberto Gil;3724;SE EU QUISER FALAR COM DEUS;Se eu quiser falar com Deus...;BRA
Gilberto Gil;3600;VAMOS FUGIR;Vamos fugir desse lugar, baby...;BRA
Gilbert O'Sullivan;4677;ALONE AGAIN;In a little while from now...;EUA
Gilliard;6005;AQUELA NUVEM QUE PASSA;Aquela nuvem que passa...;BRA
Gilson;3866;CASINHA BRANCA;Eu tenho andado tão sozinho...;BRA
Ginga Pura;3426;FRUTO DOS DEUSES;Você é meu favo de mel...;BRA
Gino e Geno;6412;ELA CHOROU DE AMOR;Ela sentiu saudade ela me...;BRA
Gino Paoli;3682;SAPORE DI SALE;Sapore di sale sapore di mare...;ITA
Girls;15284;ACENDA A LUZ;Acenda a luz tente enxergar...;BRA
Glenn Medeiros;4597;NOTHING'S GONNA CHANGE MY LOVE FOR YOU;If I had to live my life...;EUA
Gloria Estefan;4703;DON'T WANNA LOSE YOU;Sometimes it's hard to make...;EUA
Golden Boys;4384;ALGUÉM NA MULTIDÃO;Se você perdeu um amor como...;BRA
Gonzaguinha;3051;COMEÇARIA TUDO OUTRA VEZ;Começaria tudo outra vez...;BRA
Gonzaguinha;4358;LINDO LAGO DO AMOR;E quem que viu o bem-te-vi...;BRA
Gonzaguinha;3189;O QUE É O QUE É;Eu fico com a pureza da...;BRA
Gonzaguinha;3928;PONTO DE INTERROGAÇÃO;Por acaso algum dia você se...;BRA
Gonzaguinha;6076;SANGRANDO;Quando eu soltar a minha voz...;BRA
Grafite;3431;MAMMA MARIA;Fim de semana você me liga...;BRA
Gretchen;4429;CONGA CONGA CONGA;Conga conga conga... Conga la...;BRA
Grupo Cafuné;3625;MELÔ DO PIRULITO;Olha o piu piu ôh... pirulito...;BRA
Grupo Feitiço;3902;AMOR PERFEITO;Fecho os olhos pra não ver passar o tempo;BRA
Grupo Malícia;3720;PRIMEIRO BEIJO;Pára de tanta bobagem só pra...;BRA
Grupo Malícia;3541;SENTINELA;Na janela do meu quarto...;BRA
Grupo Pirraça;3117;INIGUALÁVEL PAIXÃO;És inigualável na arte de amar...;BRA
Grupo Pirraça;3190;O QUE É QUE EU VOU FAZER;Eu não passo de um brinquedo...;BRA
Grupo Pirraça;3233;QUEM DE NÓS;Quantas vezes eu te perguntei...;BRA
Grupo Raça;3086;EU E ELA;Numa linda noite bela saímos...;BRA
Grupo Raça;3483;O TEU CHAMEGO;Na vida se promete mais...;BRA
Grupo Raça;3592;PURA EMOÇÃO;É frio sem você, meu amor...;BRA
Grupo Raça;3346;TÔ LEGAL;Não faz mal se o sonho...;BRA
Grupo Revelação;6488;CORAÇÃO RADIANTE;O que mais quero é te dar um...;BRA
Grupo Revelação;15249;FALA BAIXINHO;Fala baixinho que ninguém...;BRA
Grupo Revelação;6418;GRADES DO CORAÇÃO;Quando eu te vi pela primeira...;BRA
Grupo Revelação;6547;PRECISO TE AMAR;Eu estou apaixonado deixa eu...;BRA
Grupo Sampa;3324;EU AMO VOCÊ;Os dias se passam não sou...;BRA
Grupo Sampa;3325;FLAGRANTE;Lá se vão meus anéis vão com...;BRA
Grupo Tempero;3516;DEIXA EU TE QUERER;Bate triste o coração, sem...;BRA
Grupo União;3710;JURA DE AMOR;Você veio de repente e...;BRA
Guess Who (The);4679;AMERICAN WOMAN;American Woman stay away...;EUA
Guilherme Arantes;3045;CHEIA DE CHARME;Quando a vi logo ali tão perto...;BRA
Guilherme Arantes;3513;COISAS DO BRASIL;Foi tão bom te conhecer...;BRA
Guilherme Arantes;3059;DEIXA CHOVER;Certos dias de chuva...;BRA
Guilherme Arantes;3097;ÊXTASE;Eu nem sonhava te amar...;BRA
Guilherme Arantes;3125;LANCE LEGAL;Caminhar ao seu lado...;BRA
Guilherme Arantes;3156;MEU MUNDO E NADA MAIS;Quando eu fui ferido vi tudo...;BRA
Guilherme Arantes;3188;O MELHOR VAI COMEÇAR;Eu quero o sol ao despertar...;BRA
Guilherme Arantes;3217;PLANETA ÁGUA;Água que nasce na fonte...;BRA
Guilherme Arantes;3274;TRILHAS;Traços de nanquim não se...;BRA
Guilherme Arantes;6517;UM DIA, UM ADEUS;Só você pra dar a minha vida...;BRA
Guilherme e Santiago;6627;O NOSSO AMOR;Nana nana... O nosso amor é...;BRA
Guilherme e Santiago;15315;QUANDO BEBE;E quando bebe fica louca...;BRA
Gustavo Lins;6610;ESCONDIDA;Já tá fazendo um tempo...;BRA
Gustavo Lins;6585;PRA SER FELIZ;Quando a gente ficou nem...;BRA
Gustavo Mioto;16271;IMPRESSIONANDO OS ANJOS;Hoje foi tudo bem só um pouco cansativo;BRA
Gusttavo Lima;15170;DIZ PRA MIM (JUST GIVE ME A REASON);Desde o início você esteve...;BRA
Gusttavo Lima;15171;DOIDAÇA;Tá me provocando a noite...;BRA
Gusttavo Lima;15297;FUI FIEL;Foi bonito foi foi intenso...;BRA
Gusttavo Lima;15240;REFÉM;Eu não me imaginava sem você...;BRA
Hank Williams;4527;JAMBALAYA;Goodbye Joe me gotta go...;EUA
Hanói Hanói;3394;TOTALMENTE DEMAIS;Linda como um neném...;BRA
Harmonia do Samba;4383;AGACHADINHO;Tem gente que só anda de...;BRA
Harmonia do Samba;6021;NOSSA PARADINHA;Me dá licença que Agora eu...;BRA
Harry Belafonte;4661;TRY TO REMEMBER;Try to remember the kind of...;EUA
Harry Belafonte;4557;WHEN THE SAINTS GO MARCHIN' IN;I am just a weary pilgrim...;EUA
Helen Reddy;4520;I DON'T KNOW HOW TO LOVE HIM;I don't know how to love Him...;EUA
Henrique e Diego - Gusttavo Lima;15174;FESTA BOA;A festa é boa é hoje e nóis...;BRA
Henrique e Juliano;15813;CUIDA BEM DELA;Sabe aquela menina sentada...;BRA
Henrique e Juliano;16693;LIBERDADE PROVISORIA;No inicio foi assim;BRA
Henrique e Juliano - João Neto e Frederico;15308;NÃO TÔ VALENDO NADA;Logo hoje que eu saí com a...;BRA
Henrique e Juliano - Marília Mendonça;16001;FLOR E O BEIJA-FLOR;"Essa é uma velha história de uma flor
";BRA
Heróis da Resistência ;3858;SÓ PRO MEU PRAZER;Não fala nada deixa tudo...;BRA
Hino do Corinthians;3113;HINO DO CORINTHIANS;Salve o Corinthians...;BRA
Hino do Flamengo;6063;HINO DO FLAMENGO;Uma vez Flamengo sempre...;BRA
Hino do Palmeiras;3427;HINO DO PALMEIRAS;Quando surge o alvi verde...;BRA
Hino do Santos;3126;HINO DO SANTOS (LEÃO DO MAR);Santos Santos Gol...;BRA
Hino do São Paulo;3248;HINO DO SÃO PAULO;Salve o Tri-color paulista...;BRA
Hino Nacional Brasileiro;4353;HINO NACIONAL BRASILEIRO;Ouviram do Ipiranga às margens...;BRA
Hollies (The);4711;HE AIN'T HEAVY HE'S MY BROTHER;The road is long with a many...;EUA
Inezita Barroso;4277;LUAR DO SERTÃO;Não há ó gente ó não luar...;BRA
Inezita Barroso;15259;MODA DA PINGA;Com a marvada pinga é que eu...;BRA
Inimigos do Rei;3348;UMA BARATA CHAMADA KAFKA;Encontrei uma barata na...;BRA
IRA!;15295;ENTRE SEUS RINS;Te amo isso eu posso te dizer...;BRA
IRA!;6056;ENVELHEÇO NA CIDADE;Mais um ano que se passa mais...;BRA
IRA!;15227;EU VOU TENTAR;Hoje eu saio cedo sem saber...;BRA
IRA!;4377;TEOREMA;Não vá embora fique um pouco...;BRA
IRA!;15275;TOLICES;São tolices que penso sobre...;BRA
Irene Cara;4577;FAME;Baby look at me and tell me...;EUA
Irene Cara;4799;WHAT A FEELING;First, When there's nothing...;EUA
Israel e Rodolffo;17112;BATOM DE CEREJA;Parei pensei quase travei;BRA
Israel Novaes;15319;VÓ, TÔ ESTOURADO!;Alô vó tô estourado vó tô...;BRA
Ivan Lins;6601;ABRE ALAS;Abre alas pra minha folia já...;BRA
Ivan Lins;3833;COMEÇAR DE NOVO;Começar de novo e contar...;BRA
Ivan Lins;4434;DEPENDE DE NÓS;Depende de nós...;BRA
Ivan Lins;3261;SOMOS TODOS IGUAIS NESTA NOITE;Somos todos iguais nesta noite...;BRA
Ivan Lins;3290;VITORIOSA;Quero sua risada mais gostosa...;BRA
Ivete Sangalo;6526;ASTRAL;Astral pra cima pra entrar no...;BRA
Ivete Sangalo;4348;CANIBAL;Morava numa ilha perdida e...;BRA
Ivete Sangalo;6430;PENSO;Penso... penso naquele menino...;BRA
Ivete Sangalo;6073;PERERÊ;Pê pererê pê pê... Pererê saiu...;BRA
Ivete Sangalo;4457;SE EU NÃO TE AMASSE TANTO ASSIM;Meu coração sem direção...;BRA
Ivete Sangalo;6636;SORTE GRANDE;A minha sorte grande foi você...;BRA
Ivete Sangalo;4297;TÁ TUDO BEM;Chegou e me levou como uma...;BRA
Ivete Sangalo - Alejandro Sanz;15182;NÃO ME COMPARES;Agora que gemem mais pálidas...;BRA
Ivo Mozart - NX Zero;15205;A FESTA;A festa já vai começar pode...;BRA
Jackson 5;4720;I'LL BE THERE;You and I must make a pact...;EUA
Jair Rodrigues ;4268;DISPARADA;Prepare o seu coração...;BRA
Jair Rodrigues ;3330;MAJESTADE O SABIÁ;Meus pensamentos tomam...;BRA
Jair Rodrigues ;6624;O CONDE;Lá iá lá iá... Encontrei hoje cedo...;BRA
Jamelão;3142;MATRIZ OU FILIAL;Quem sou eu pra ter direitos...;BRA
James Taylor;4693;CAROLINA IN MY MIND;In my mind I'm gone to Carolina...;EUA
James Taylor;4702;DON'T LET ME BE LONELY TONIGHT;Do me wrong do me right...;EUA
James Taylor;4707;FIRE AND RAIN;Just yesterday mornin'...;EUA
James Taylor;4780;SWEET BABY JAMES;There is a young cowboy he lives...;EUA
Janaynna Targino - Jorge e Mateus;15241;A CARNE É FRACA;Toda noite saio com os...;BRA
Jane e Herondy;4325;NÃO SE VÁ;Não se vá eu já não posso...;BRA
J.B. Samba;3886;NA PALMA DA MÃO;Um bom pagode começa assim...;BRA
Jerry Adriani;4428;COM TERNURA;Vem comigo, vem sentir como...;BRA
Jerry Adriani;3703;DIANA;Não te esqueças meu amor...;BRA
Jessé;3894;PORTO SOLIDÃO;Se um veleiro repousasse...;BRA
Jim Reeves;4517;HE'LL HAVE TO GO;Put your sweet lips a little...;EUA
Joanna;3824;AMANHÃ TALVEZ;Faz que desse jeito só você...;BRA
Joanna;3157;MEU PRIMEIRO AMOR;Saudade palavra triste...;BRA
Joanna;4337;TÔ FAZENDO FALTA;Ontem te encontrei você estava...;BRA
João Bosco;6462;JADE;Aqui meu irmão ela é coisa...;BRA
João Bosco;6612;KID CAVAQUINHO;Ói que foi só pegar no...;BRA
João Bosco e Vinícius;15168;COLO COLO;Saiu de casa foi pra farra pra...;BRA
João Donato;6579;NÃO SEI COMO FOI;Não sei se foi a canção de...;BRA
João Lucas e Diogo - MC Koringa;15163;ÁGUA NA BOCA;Quando ela passa agita a...;BRA
João Lucas e Marcelo - MC K9;15176;LOUCA LOUQUINHA;Louca louquinha da uma...;BRA
João Mineiro e Marciano;3738;ALINE;Ontem retornei na areia...;BRA
João Mineiro e Marciano;3683;SEU AMOR AINDA É TUDO;Muito prazer em revê-la você...;BRA
João Neto e Frederico - Jorge e Mateus;15167;CLICHÊ;Criei canções e melodias pra...;BRA
João Paulo e Daniel;3790;ELA TEM O DOM DE ME FAZER CHORAR;Deus, hoje eu vim aqui pra...;BRA
João Paulo e Daniel;3362;ESTOU APAIXONADO;Uh... la la iê ôh... Quero beber...;BRA
João Paulo e Daniel;3793;EU ME AMARREI;Eu me amarrei, eu me amarrei...;BRA
João Paulo e Daniel;3754;HOJE EU SEI;Outra vez eu cheguei tarde...;BRA
João Paulo e Daniel;3476;MINHA ESTRELA PERDIDA;Você vai rir quando eu pedir...;BRA
João Paulo e Daniel;3770;ROSTO MOLHADO;Enxugue o rosto meu amor não...;BRA
João Paulo e Daniel;3818;TE AMO CADA VEZ MAIS;Pegue-me aqueça-me em seu...;BRA
João Paulo e Daniel;3779;VOCÊ SÓ ME FAZ FELIZ;É nesse sonho que eu me...;BRA
João Pedro e Cristiano;4418;VIDA CIGANA;Ó meu amor não fique triste...;BRA
John Denver;4565;ANNIE'S SONG;You fill up my senses like...;EUA
John Denver;4550;SUNSHINE ON MY SHOULDERS;Sunshine on my shoulders...;EUA
John Denver;4607;TAKE ME HOME COUNTRY ROADS;Almost heaven, west Virginia...;EUA
John Denver-Placido Domingo;4753;PERHAPS LOVE;Perhaps love is like a...;EUA
John Lennon;4523;IMAGINE;Imagine there's no heaven...;EUA
John Lennon;4640;LOVE;Love is real real is love...;EUA
John Lennon;4549;STAND BY ME;When the night has come...;EUA
John Lennon;4805;WOMAN;Woman, I can hardly express...;EUA
Johnny Horton;4561;ALL FOR THE LOVE OF A GIRL;Well today I'm so weary today...;EUA
Johnny Mathis;4594;MISTY;Look at me I'm as helpless as...;EUA
Johnny Rivers;4699;DO YOU WANNA DANCE;Do you wanna dance and hold...;EUA
John Travolta-Olivia Newton John;4776;SUMMER NIGHTS;Summer loving had me a blast...;EUA
Jorge Aragão;4476;FEITIO DE PAIXÃO;Queria o prazer do amor assim...;BRA
Jorge Aragão-Exaltasamba;6016;EU E VOCÊ SEMPRE;Logo logo assim que puder...;BRA
Jorge Aragão-Jorge Vercilo;6569;ENCONTRO DAS ÁGUAS;Sem querer te perdi tentando...;BRA
Jorge Aragão-Zeca Pagodinho;6497;MUTIRÃO DE AMOR;Cada um de nós deve saber se...;BRA
Jorge Benjor;3001;A BANDA DO ZÉ PRETINHO;A banda do Zé Pretinho chegou...;BRA
Jorge Benjor;3402;ALCOHOL;O Mago mandou avisar...;BRA
Jorge Benjor;3048;CHOVE CHUVA;Chove chuva chove sem parar...;BRA
Jorge Benjor;3468;ENGENHO DE DENTRO;Olhaí meu bem prudência e...;BRA
Jorge Benjor;3795;FIO MARAVILHA;Novamente ele chegou com...;BRA
Jorge Benjor;3758;MAS QUE NADA;Oh, Bahia aiô obá, obá, obá...;BRA
Jorge Benjor;6628;O TELEFONE TOCOU NOVAMENTE;O telefone tocou novamente...;BRA
Jorge Benjor;3852;PAÍS TROPICAL;Moro num país tropical..;BRA
Jorge Benjor;3721;QUE MARAVILHA;Lá fora está chovendo...;BRA
Jorge Benjor;3722;QUE PENA (ELA JA NÃO GOSTA DE MIM);Ela já não gosta mais de mim...;BRA
Jorge Benjor;3297;W BRASIL (CHAMA O SÍNDICO);Alô alô W Brasil...Alô alô...;BRA
Jorge e Mateus;15162;A HORA É AGORA;Ôôô... Aumente o som  pra ficar...;BRA
Jorge e Mateus;17027;LANCE INDIVIDUAL;Ja namorou noivou;BRA
Jorge e Mateus;15301;LOGO EU;Eu te vi e já te quis me vi tão...;BRA
Jorge Vercilo;15228;FACE DE NARCISO;O que é o amor vai além da...;BRA
Jorge Vercilo;6536;FÊNIX;Eu prisioneiro meu descobri...;BRA
Jorge Vercilo;6494;HOMEM-ARANHA;Eu adoro andar no abismo...;BRA
Jorge Vercilo;6473;QUE NEM MARÉ;Faz um tempão que eu não...;BRA
Jose Feliciano;4598;ONCE THERE WAS A LOVE;Once there was a love...;EUA
Jota Quest;6603;AMOR MAIOR;Eu quero ficar só mas comigo...;BRA
Jota Quest;6423;NA MORAL;Na moral... Vivendo de folia e...;BRA
Jota Quest;4287;O VENTO;Voe por todo mar e volte aqui...;BRA
Jota Quest;4489;OXIGÊNIO;Mesmo com a fumaça Dá para...;BRA
Jota Quest;6509;SÓ HOJE;Hoje eu preciso te encontrar...;BRA
Jota Quest;6032;TELE-FOME;Não alimento amor Por...;BRA
Juan Luis Guerra;3239;ROMANCE ROSA;Eu te dei uma rosa que...;BRA
Julie Andrews;4512;DO RE MI;Doe a deer a female deer ray...;EUA
Julie Andrews;4513;EDELWEISS;Edelweiss edelweiss every...;EUA
Julio Iglesias;4667;CRAZY;Crazy, I'm crazy for feeling...;EUA
Julio Iglesias e Daniel;6038;VIVER A VIDA;Deixa que eu Te fale um...;BRA
Juventude SA;4354;HISTÓRIA DE AMOR;E foi assim que tudo aconteceu...;BRA
Kansas;4575;DUST IN THE WIND;I close my eyes only for a...;EUA
Kaoma ;3836;DANÇANDO LAMBADA;Morena, cintura de mola...;BRA
Karametade;4466;COMO É QUE VOU FAZER;E quando a gente Se encontrar...;BRA
Karametade;4308;DANDÁ;Teu sorriso despertou em mim...;BRA
Karametade;3748;DECISÃO;Há tanto tempo queria te falar...;BRA
Karametade;3882;LOUCA SEDUÇÃO;Com você eu fiz amor eu fiz...;BRA
Karametade;4285;NUNCA VOU DEIXAR VOCÊ;Não mudou nada em mim...;BRA
Karametade;3814;SE MELHORAR ESTRAGA;Estava mal, de baixo astral...;BRA
Karlos e Alessandro;4392;DEIXA;Dentro desse teu sorriso eu...;BRA
Kátia;15216;CEDO PRA MIM;Eu já tive um amor que marcou...;BRA
Katinguelê;3904;APAIXONADAMENTE;Quando, te encontrei chorando...;BRA
Katinguelê;3740;APELO DE QUEM AMA;Quando eu me encontrar...;BRA
Katinguelê;3747;CILADA;Êh, mulher me comovi com sua...;BRA
Katinguelê;3318;CORPO LÚCIDO;Como é difícil entender por...;BRA
Katinguelê;3791;ENGRAÇADINHA;Linda de viver que gracinha...;BRA
Katinguelê;3669;LUANA;Eu vendo você na tristeza...;BRA
Katinguelê;4322;MINHA DEUSA;Acordo pensando em você e o...;BRA
Katinguelê;3376;NO COMPASSO DO CRIADOR;Ao teu lado sou criança nosso...;BRA
Katinguelê;3439;PEDINDO BIS;Meu bem meu coração está...;BRA
Katinguelê;3487;RECADO À MINHA AMADA;Lua vai iluminar os...;BRA
Katinguelê;3542;SÓ PEDINDO BIS;Não vejo a hora e o momento...;BRA
Katinguelê;3347;UM DOCE SABOR;Como definir seu beijo uma...;BRA
Kelly Key;6562;ADOLETA;Me ganhou com esse jeito de...;BRA
Kelly Key;6403;ANJO;Mais uma noite chega e com...;BRA
Kelly Key;6486;CACHORRINHO;Se tem uma coisa que me...;BRA
Kenny Rogers;4589;LADY;Lady, I'm yours in shining...;EUA
Kid Abelha;3002;A FÓRMULA DO AMOR;Eu tenho gestos aptos sei...;BRA
Kid Abelha;3654;COMO É QUE EU VOU EMBORA;Ah ah ah... O que é que eu...;BRA
Kid Abelha;3699;COMO EU QUERO;Diz pra eu ficar muda faz...;BRA
Kid Abelha;3518;DEUS (APAREÇA NA TELEVISÃO);Ah ah ah... Se Ele é Deus e...;BRA
Kid Abelha;3073;EDUCAÇÃO SENTIMENTAL II;A vida que me ensinaram...;BRA
Kid Abelha;3753;FIXAÇÃO;Seu rosto na TV parece um...;BRA
Kid Abelha;3524;GRAND' HOTEL;Se a gente não tivesse feito...;BRA
Kid Abelha;4397;LÁGRIMAS E CHUVA;Eu perco o sono e choro...;BRA
Kid Abelha;3166;NADA POR MIM;Você me tem fácil de mais...;BRA
Kid Abelha;6498;NADA SEI (APNÉIA);Nada sei dessa vida vivo sem...;BRA
Kid Abelha;3478;NA RUA, NA CHUVA, NA FAZENDA;Não estou disposto a...;BRA
Kid Abelha;3216;PINTURA ÍNTIMA;Vem amor que a hora é essa...;BRA
Kid Abelha;3686;TE AMO PRA SEMPRE;Na na na...pra conservar o amor...;BRA
Kiko Zambianchi ;3843;HEY JUDE;Hey Jude, não fique assim...;BRA
Kiloucura;4280;MEU CASAMENTO;Você dividiu meu coração...;BRA
Kim Carnes;4569;BETTE DAVI'S EYES;Her hair is Harrow gold her...;EUA
KLB;6481;A CADA DEZ PALAVRAS;Faz tanto tempo que eu venho...;BRA
KLB;4461;A DOR DESSE AMOR;Perdoa se estou Te ligando...;BRA
KLB;6014;ELA NÃO ESTÁ AQUI;Tá difícil esquecer Tirar você...;BRA
KLB;6630;POR CAUSA DE VOCÊ;Só você não vê finge que não...;BRA
KLB;6552;SÓ DESSA VEZ;Não consigo aceitar por que...;BRA
Kleiton e Kledir;4380;VIRA VIROU;Vou voltar na primavera...;BRA
Knack (The);4642;MY SHARONA;Oh my little pretty one...;EUA
Kool And The Gang;4694;CELEBRATION;Ya hoo ya hoo celebration...;EUA
Kris Kristofferson;4578;FOR THE GOOD TIMES;Don't look so sad, I know it's...;EUA
Kris Kristofferson;4582;HELP ME MAKE IT THROUGH THE NIGHT;Take the ribbon from your...;EUA
Lairton e Seus Teclados;4400;MORANGO DO NORDESTE;Estava tão tristonho quando...;BRA
Larissa e William;3043;CAVALEIROS DO ZODÍACO;Tem sempre alguém no...;BRA
Latino;15247;CARREL;Ca carrel ca ca carrel é o...;BRA
Latino;3144;ME LEVA;Moça eu não sei mais o que...;BRA
Latino;3167;NÃO ADIANTA CHORAR;Eu te levei a sério fiz tudo...;BRA
Laura Pausini;3799;INESQUECÍVEL (INCANCELLABILE);Às vezes me pergunto se eu...;BRA
Laura Pausini;3572;LA SOLITUDINE;Marco se n'e andato e non...;ITA
Laura Pausini;3725;SE FUÉ;Ya no responde ni al...;ESP
Leandro e Leonardo;3826;ANARRIÊ;Em toda festa de São João...;BRA
Leandro e Leonardo;3038;CADÊ VOCÊ;O tempo vai o tempo vem a...;BRA
Leandro e Leonardo;3410;CASA SEPARA;Eu quero te amar sem...;BRA
Leandro e Leonardo;3786;CERVEJA;Hoje é sexta-feira chega de...;BRA
Leandro e Leonardo;3062;DESCULPE, MAS EU VOU CHORAR;As luzes da cidade acesas...;BRA
Leandro e Leonardo;3615;DIZ PRA MIM;Diz pra mim que fazer pra te...;BRA
Leandro e Leonardo;3519;DOCE MISTÉRIO;Eu não sei de onde vem...;BRA
Leandro e Leonardo;3420;ENTRE TAPAS E BEIJOS;Perguntaram pra mim se ainda...;BRA
Leandro e Leonardo;3705;É POR VOCÊ QUE CANTO (THE SOUND OF SILENCE);Quanto mais o tempo passa...;BRA
Leandro e Leonardo;3911;ESSAS MULHERES;Essas mulheres nos tiram e...;BRA
Leandro e Leonardo;3422;ESTA NOITE FOI MARAVILHOSA;A noite vem vindo estrelas...;BRA
Leandro e Leonardo;3469;EU JURO;Eu vejo a luz do teu olhar...;BRA
Leandro e Leonardo;3663;EU SOU DESEJO, VOCÊ É PAIXÃO;Você me amou e eu te amei...;BRA
Leandro e Leonardo;3098;FAZ MAIS UMA VEZ COMIGO;Não paro de rolar na cama...;BRA
Leandro e Leonardo;3522;FESTA DE RODEIO;Em festa de rodeio não dá...;BRA
Leandro e Leonardo;3798;HORIZONTE AZUL;O que mais me dói em noites...;BRA
Leandro e Leonardo;3430;MAIS UMA NOITE SEM VOCÊ;Mais uma noite sem você...;BRA
Leandro e Leonardo;3168;NÃO APRENDI DIZER ADEUS;Não aprendi dizer adeus...;BRA
Leandro e Leonardo;3335;NÃO OLHE ASSIM;Tire seus olhos dos meus...;BRA
Leandro e Leonardo;3208;PAZ NA CAMA;Quando alguém lhe perguntar...;BRA
Leandro e Leonardo;3441;PENSE EM MIM;Em vez de você ficar pensando...;BRA
Leandro e Leonardo;3716;PIMBA;Pode crer rapaziada tudo em...;BRA
Leandro e Leonardo;3633;POR CAUSA DELA;Por causa dela eu perdi o...;BRA
Leandro e Leonardo;4294;RUMO A GOIÂNIA;É noite o carro está rugindo...;BRA
Leandro e Leonardo;3262;SONHO POR SONHO;Nunca imaginei que você...;BRA
Leandro e Leonardo;3449;TEMPORAL DE AMOR;Chuva no telhado, vento no...;BRA
Leandro Lehart;6405;CAMILA BANDIDA;"""Essa é a história de uma...";BRA
Leci Brandão;3525;ISSO É FUNDO DE QUINTAL;O que é isso meu amor...;BRA
